,Review,Freshness
1933,The Art of Self-Defense is a very good and very black comedy. So black that I might have been the only one in the room laughing with certain jokes. [Full Review in Spanish],1
2787,The problem is that integrating so many characters ends up turning the plot into a real disaster. [Full review in Spanish],0
304111," Outrageous and outlandish, Emmerich's 10,000 BC is easy to mock, but it is so cheerfully shameless and terminally silly that you have to admire its effrontery and accept its creator... as a certified crackpot visionary.",1
34782,"Perhaps the movie is working with the theory that if you do a schtick a million times, it eventually becomes funny. In this case, it really doesn't.",0
2912,"This is not merely a Garbo film, it is a Lubitsch film, and the result is enchanting.",1
2667,Candy Corn is stale and not nearly sweet enough for genre fans.,0
3647,"At second glance, A Score to Settle reveals itself as a swarm of cliches that ring louder than bullets.",1
49046,The Trainspotting team have managed to come up with one of the best examples of how good sequels work.,1
13891,"Directed with muddled confusion, the movie goes through its stock characters and obligatory plot points without enthusiasm or charm.",0
3103,The illuminating documentary -a must-see for serious cinephiles- delivers a cascade of information and insight in a clear and dynamic manner. [Full review in Spanish],1
228158," Even if Wheelman never goes beyond being a typical genre film, Frank Grillo helps elevate it and is the only reason to give it a watch. ",1
6152," Luhrmann lovingly titivates the fake and superficial, and never gets round to serving the meat of the novel, which involves cutting into sham and heartlessness.",0
1881,"This is some stunningly stilted comedy . . . and while it doesn't come close to warranting its 101-minute runtime, the attention to detail here is too strong to dismiss.",1
27304,"My, The Artist is delightful, ingenious, funny, poignant and, in its own small way, profound. Put Oscar on high alert.",1
29363,"Still, there are moments of emotional truth, especially a key scene when Peter finds a way, however briefly, for Gloria to realize her dream of playing Juliet onstage. And if this movie revives interest in Gloria Grahame's vintage movies, I'm all for it.",1
425058, The cat-and-mouse sequences in this film are revelatory -- they're why we go to the movies in the first place.,1
12440,"If Breathed's style could have been applied to the animation, this offbeat story would have a better chance at success. Instead, we're left with a kids' movie that leaves audiences cold.",0
3502,"...a taut dramatic thriller that is as much about overcoming adversity and the drive of an artist to be free, as it is about Nureyev, the Cold War or ballet.",1
374,"If the movie is a Rorschach of who you identify as parasite and host, it's a test you're just as likely to fail; a filmgoing experience that refuses to fit into any box, and forces viewers to breathe the dangerous air outside of it too.",1
11786,Somehow the knowledge that you are three degrees of separation from Dabney Coleman and a computer called W.O.P.R. transforms trite claptrap into the words of the Bard himself.,0
240167, [Mol] delivers the best performance of her career.,1
409754, They are not putting any of the funny stuff from The Love Guru in the trailer. This is a rapid assault of comedy.,1
2993,"Doesn't exactly make over the rom com playbook, but diligently sticks to the established rules with a charming cast and relaxed premise that it's worth booking a reservation.",1
2621,"Intriguing variation on the digital ""romance"" of ""Her,"" a bit chilly and bloodless.",0
160904," Mary Queen of Scots is a handsome film, dressed to the nines in distracting costumes, which, once removed reveal a rather skeletal screenplay.",0
31513,"So insubstantial that it practically evaporates on screen, Pooh's Heffalump Movie likely will play best with toddlers and pre-schoolers easily amused by bright colors, merry songs and lovable, huggable toontoon animals.",0
2411,"Despite the potential double product cross marketing MO, Super Size Me 2 resounds as a heart-felt follow-up and Spurlock's best film since the original.",1
170920, It makes you think about the clichéd pictures of Asian kids in the popular imagination and how painful it must be for them to carry the burden of perfection.,1
2185,"It's interesting to watch Tracy Edwards' maturation as a person -- she goes from claiming that she hates the word ""feminist"" to wholeheartedly embracing it.",1
110627," RocknRolla is a return to form for Ritchie and an enjoyable, well made crime caper that should delight fans of Lock, Stock and Snatch.",1
2000,Mother's love trumps dirty politicians in fact-based drama.,1
246597, The thrills of the JP franchise are all but extinct.,0
1080,"A few shadowy ghouls and moments of visual trickery aside, The Divine Fury fails to deliver the scares one would expect from a film dealing with exorcisms.",0
47609,It's so sad that Phoenix went out not with a bang but with this whimper.,0
106501, It's more Scenes from a Marriage than Dirty Dancing.,0
24082,There's no rule that videogame movies have to be idiotic. And there's no rule that action-horror flicks need be dumb.,0
44838,"It's beautiful, it's funny, it's colorful. But somehow the magic isn't exactly there in full measure.",1
1221,Salam had me rooting for him throughout.,1
53743,"The movie's space battle...have a swiftness, an electricity and, most importantly, a clarity lacking in the works of other so-called sci-fi masters.",1
96671, Writer-director Christopher McQuarrie brings a dark and gritty tone to this larger-than-life franchise.,1
7738,"This sanitized version of inner-city life deserves points for its game attempt to create an uplifting tale, but outside some flashy basketball sequences, it rarely comes to life or generates much believability.",0
5177,"This sequel doubles down hard on the comedy and delves deeper into the mythology of the time loop, rendering it less a horror movie and more of an outright sci-fi caper [...]",1
288200," Nicolas Winding Refn's atmosperic direction, Gosling's sheer presence and a soundtrack that's perfection make Drive a fantastic film.",1
604,"Miles Robbins flourishes in the role of Luke, switching from vulnerable loner to suave romancer with ease.",1
216186, A good-natured bit of escapist fluff that relies a bit too much on whiz-bang special effects.,1
1088,"At best, an interesting idea that seems to get lost in the cigarette smoke",0
223463," Even though the Hawaii locations are beautiful, without Russell Brand this film would be a big dud.",0
1552,"Octavia Spencer, Naomi Watts and Tim Roth help deliver an intriguing, intelligent and realistically unresolved drama.",1
28537,"A minor flaw or two but assuming you don't spend all of your days barefoot like a Hobbit, the movie will knock your socks off. ",1
355988," Suffragette trundles along well enough, all noble and serious, but it doesn't get the blood up the way a protest movie probably should.",0
4713,It becomes clear early on that Five Feet Apart benefits substantially from the almost unreasonably charismatic work of its two stars...,1
1761,"It may be directed by the world's oldest director, but it's one of Oliveira's most potent and rewarding titles from this late portion of his career, as well as an indication that he's lost none of his talents as one of the world's notable directors.",1
427447," While it's no Bad Santa in terms of relentlessly invigorating bad taste, the movie has more than enough for aficionados of guilty pleasure.",1
201,"Goes almost wholly wrong from that magic moment AFTER we wonder, ""Just what the Hell is going on here?""",0
30396,The cast outclasses the material.,0
769,"[The Two Popes] a truly singular viewing experience featuring two actors at the top of their game, stunning technical credits, a brilliant screenplay and extraordinary directing.",1
327679," Patient Zero wets an appetite to see similar films, but certainly not to rewatch the film itself.",0
2031,"Vapid, pointless and wholly predictable.",0
39865,Logan Lucky is a fun and engaging caper movie directed by Steven Soderbergh.,1
28873," ""Rango"" is a delight from start to finish, both visually and in its creative writing.",1
288552, A marvel of contemporary filmmaking...,1
4683," There isn't a single component of this entirely tedious exercise that hasn't been seen before, including the plot itself.",0
13906,"This is a charmless, lifeless affair that had me leaving the theater in a mood more appropriate to a funeral than a wedding.",0
125922," A strong effort from Damon/Krasinski/Van Sant. It's entertaining, and heck- you may learn something too. ",1
5195,A competent and violent thriller. [Full Review in Spanish],1
43766,"Payne and Dern find Modest Nobility in ""Nebraska",1
468854," The script, such as it is, takes the form of a kinky fairy tale set in a violent, brutish world; imagine the Brothers Grimm rewritten by Charles Dickens as a letter to Penthouse Forum.",0
9087,"Hereafter is deep and deliberate. It requires patience and emotional maturity from its audience. Those willing to give it will be rewarded with a cinematic experience that is complex, heartfelt and spiritually uplifting.",1
12001," It's the funniest, smartest, goofiest, dirtiest, coolest (and longest -- over two hours, in fact) comedy so far this year.",1
797,"A fascinating, if heartless, failure, skimming the surface of the conspiracy, not doing justice to the tragedy.",0
3763,"This should be right up my alley as I love the music and Elle Fanning as an actress, but it's hard to like a movie when you don't root for the lead character.",0
144,Strong performances can't overcome the disconnect that occurs halfway through the movie.,0
28872,"Slavin has captured on film the smallness, the sameness, the overwhelming conformity of that time and place.",1
1436,"Despite these issues, a discernible micro-budget, and a poorly-realized degenerative brain ailment, the film could have worked were it not for the big reveal...",0
5463,"While Efron takes charge, the rest of the film feels as if it's struggling to catch up.",1
3160,"Will click with audiences seeking substanceless diversion, or a change of pace from year-end heavyweight titles. Those who prefer to be challenged will stay away, wisely.",0
1716,"Even with the best of the intentions in mind, Soderbergh didn't avoid a mess, plunging The Laundromat into a sea of silliness and artifice.",0
4883,"[DIrector] Hildebrandt... finds an entertaining pace that makes great use of its subjects with their stories, recollections and anecdotes.",0
19408,"McDormand kicks against convention and expectation, with an out-of-the-box performance that delivers what one would hope for, and so much more. ",1
1849,"It might have worked as a short film -- in fact, it could have made a great one -- but as a feature film, it feels like it's stretched way too thin. The movie is not as funny as it thinks it is, though it is perhaps a good deal meaner.",0
2786,"The commentary is valuable and timely, but the narrative and formal vehicle -- even with its wonderful moments -- is not that solid. [Full Review in Spanish]",1
972,"Rinsch's vision of Japan is brimming with imagination, and I found myself wishing I could spend more time there. I just don't want any of these people with me.",0
131396," I'll See You in My Dreams could easily slip into senior citizen cliché nightmares, but the screenplay, by Haley and Marc Basch, packs plenty of respect for this character demographic.",1
4526,"It's difficult to know who is more indulged here, Matthew McConaughey, who plays the title character, or director and art-house favourite Harmony Korine, who has assembled a starry cast despite not having made a decent film for years.",1
2111,"Thanks to this antagonism and a few good jokes, the film is very entertaining. [Full review in Spanish]",1
2981,"Pound for pound, boxing must throw up more bizarrely larger-than-life characters than any other sport, and in the figure of Vinny Pazienza... [Miles Teller] is indubitably playing one of those.",1
18147,"Watching Amy Berg's powerful documentary Deliver Us from Evil is a wrenching experience; her subjects reveal to the camera almost unbearable levels of anguish, and its audience walks away feeling both numbness and rage.",1
176787," The attempts to turn these corny stories into some sort of epic strain with flopsweat, and the hoped-for Avengers-style team-up of the company's big two mostly results in scenes where you wonder why Frosty's not melting in the middle of July.",0
182359," Glib, ego-thumping disaster that tries so hard to be cool that flop-sweat practically drips off the sprockets.",0
6890,A transparent excuse for a constant parade of topless females eager to assume a compromising position. The only thing missing was a cheesy porn soundtrack.,0
1505,"There's no real message here to ""Uncaged"" beyond watching some sharks eviscerate a young girl's entire life and livelihood.",0
1064,"Intriguing use of the form, but basically a mockumentary ""thriller"" that works only when it's mocking.",0
6199,"The political intrigue subplot feels tacked on and dull, the film is entirely too long for a simple revenge melodrama...and the structure mercilessly follows its predictable pattern...",0
2354,"With that first impression alone, it's a failure. Upon delving deeper and watching the film, it's a dangerous and offensive failure.",0
28429,"Unfortunately, the adolescent world created within the film extends to its conception.",0
201466," A Dog's Purpose is a movie with a good heart telling a well-intentioned story, but the constant tugging of heartstrings ultimately results in a fraying that significantly lessens the overall impact of the film.",0
47644,"Don't reach for the remote control. It's not going to help you navigate Resident Evil, the latest video game making its awkward transition to the screen.",0
47992," Tattoo is a flaccid, rancid and astonishingly tedious melodrama making a theatrical appearance before landing on the pay TV screen at 1 or 2 in the morning where it belongs.",0
369390," Though a little overdone in places, Lords of Chaos is a fascinating, suitably bleak window into a most infamous and disturbing corner of music history.",1
13973,Even the most ardent evacuees from Super Bowl madness will recognize the familiar road map that the screenplay diligently follows.,0
4410,"The directors of Pressing On also appreciate the beauty of the moving parts as these majestic apparatuses...bring signs, posters, and other printed matter to life.",0
1748,Fire in Paradise is a difficult watch. But it's a must-watch.,1
2921,"""5B"" is a necessary film, even if you thought you were infinitely familiar with the mistakes of the past.",1
3938,"Deadtectives offers a groovy, free-wheeling energy that dips back and forth between scary and funny with shocking ease.",1
38608,There's an overly familiar feel to all of it. We have been here before.,0
2094,"Ocelot's intentions may be pure, but his handling of the serious social issues he tackles is so lacking in nuance that it borders on embarrassing.",0
3235,A high-concept romcom that just reeks of soulless calculation.,0
43520,"Not the funniest film ever on this subject, but a nice statement and satire on relationships today.",1
2979,An awkward entry in the growing genre of Travoltasploitation.,0
1342,"Instead, it's a clever, not-too-sentimental Hatfields v McCoys take on the legend of Santa Claus.",1
11131,"A formula family tearjerker told with a heavy Irish brogue...accentuating, rather than muting, the plot's saccharine thrust.",0
340683, It's tempting to say that Bertrand Tavernier's 3-hour-and-15-minute documentary... is a feast for everybody who loves classic Gallic movies. This is certainly true. But it's also a movie for people who just plain love movies,1
4902,"The true shock of Rolling Thunder Revue is in how good, how alive, Dylan is on stage.",1
4241,"The Quiet One isn't a bad documentary on Bill Wyman, the bassists for The Rolling Stones from 1962 to 1993, or a bad documentary in general. It just suffers from arriving too late to the party to add much to a well-worn story.",1
20674,"It is a shame that a movie about the people who are most passionate about edgy, imaginative stories is itself slipshod and formulaic.",0
1633,"A feel-good film, warm and good-hearted.",1
46478, What could have been an important and timely film in an era of distrust in journalism is sadly wasted. The film bombards its audience with surgically rapid scenes that feed as much information as possible with no emotional pay off.,0
200047," 'Abandon all hope, ye who enter here'...you should definitely let Dante's gloomy words be your guide.",0
45268,"Without Limits is an admirable departure from the norm, but its greatest strength doubles as an undermining weakness.",1
775,"Vandervoort does her best to give Rose more depth than the script offers, but it's an uphill battle.",0
426349," Ms. Henson, ever simmering, takes Mary's moral conundrum very seriously. Her expressive eyes and nuanced body language work well for the character; she can put across a major change in attitude just by shifting a hip.",1
3327,Dib's transformation was great.... It's a solid special.,1
6502," I guarantee to you that this film will, in a few years, be regarded as a small classic. Discover Once now.",1
48813,"This haunting life story is an exquisite example of non-fiction filmmaking as full-bodied, emotionally complex drama.",1
241814," The film is nothing short of outstanding, particularly if seen on a big IMAX screen in 3D. (Full Content Review for Parents also available)",1
21227,To stay invested in the dulldrum vigilantism of Hannibal Rising requires siding with a psychopath.,0
36756,"[A] dreary Disneyfied inconsequence [that] features all the bigotries of century-old pulp fiction and none of the romance, neither the sexual nor the adventurous kind.",0
5141,"""Ladies in Black"" doesn't aim to overwhelm, and it achieves most of the small goals it sets for itself, doing period Australia with interest in character desires and future plans.",1
4357,"Despite all the devilishly clever moments, freaky episodes, and general weirdness, Under the Silver Lake is ultimately unsatisfying.",1
111444, This film is almost like spending the day in the phone looking at social networks: a waste of time. [Full review in Spanish],0
36230,'Sucken.',0
10225,How nice it is to see that representation is presented as so normal.,1
22304,"Somewhat overly sentimental, lacking the novel's subtlety, and less interesting when the action leaves the ball park, Barry Levinson's beautifully shot film is nonetheless a charming fairy tale.",1
252275," The great intangible of chemistry isn't present, making Water for Elephants seem longer and slower than one might hope.",0
364,"In ten years, they couldn't come up with enough new ideas that they had to copy so many from the first one?",0
35014, An unlikely-buddy horror flick which figured a viable way of walking a fine line between the sadistic and the sublime.,1
453267, ... standard PBS Masterpiece fare ... self-consciously arty and as studied as a John Constable pastoral come to life ... has small-town hypocrites in its sights but is too polite to pull the trigger ,0
14102,The writing team of Dan Fogelman and co-director Williams have concocted one of the most witty and often hilarious Disney outings in years.,1
262973," V for Vendetta is a confounding exercise that has no trouble getting people to think, but it's far less successful at getting them to feel.",0
13089,"Jordan Vogt-Roberts' The Kings of Summer features an economic script, likable characters, a fun style and plenty of sharp humor -- although its plot is a bit on the slim side.",1
422245, An entertaining gonzo-style doco about the history and meaning of the southern hemisphere's most iconic constellation. ,1
1306,"It's less of an insightful backstage documentary than a gushing, sycophantic love letter to the late Merce Cunningham.",0
452330," a soap opera for people who don't watch soap operas; Dawson's Creek for those who scoff at the prospect of watching James van der Beek, Katie Holmes and - yes - Michelle Williams, shooting the pop culture breeze.",0
35599,"A sugar-sweet, nutty kind of chip-muck, but cinematic excrement all the same.",0
448657," On the surface, Brigsby Bear will seem somewhat removed from the reality we might imagine from such serious subject matter. But that distance gives the narrative and its characters life. ",1
5340,"In Search of Greatness, the latest from Gabe Polsky (Red Army), explores the passion, obsessiveness, and creativity in sports. But, though intriguing and sometimes adrenalizing, this search stumbles.",1
28546,"The Hobbit: An Unexpected Journey"" has finally arrived, not on wings of gossamer fancy but with a hairy-footed thud.",0
359022," Filled with bizarre colors, vintage 70s-era rock and truly imaginative ideas, it's still a thrill.",1
7340,A dud from Seth MacFarlane.,0
18221,"As the romantic lead, Paul Walker would be a stiff in any century...",0
13521," ...in the midst of all the perverse chaos, a story emerges that is easily the most tender and even sentimental in all of Gilliam's work.",1
1522,"Dramatic moments can and do work within dark comedies, and vice-versa - but by being both at once, The Kitchen ends up giving its audience cinematic whiplash.",1
561,"""Edie"" has a firm grasp on kindness and delivers the occasional corny turn of character, but there are a few raw nerves worth paying attention to.",1
45090,"Does what it promises -- gives great tense drama and action. However, jerky camera work is somewhat annoying.",1
52848,"Immaculately performed, and assembled with wit and sensitivity, this is one of the most satisfying weepies in years.",1
184,"Featuring a solid turn from Justin Long, The Wave is a delightfully different drug comedy. While it may not be the most important film of the year, its messages about anyone being able to change and chasing happiness feel timely and engaging.",1
1973,"If you enjoyed the original series and respect Gilligan's commitment to giving Jesse a send off, you'll probably get a lot out of this extra two hours of screen time.",1
5031,"FUNNY STORY has a few minutes of humor, but it takes more than that to make a ""funny story.",1
1108,Bikram marks Orner's style as one of the doggedly determined documentarian as her films tell urgent stories buoyed by hard-to-get images that hold guilty parties accountable for their crimes.,1
47289, A so-so action flick that wants to be taken for something profound with a capital 'P.',0
374062," It's a tidy 70 minutes, and for extra artiness, it's handsomely shot in black and white. If you like these sorts of dramatic exercises, you could do worse than watching this talented crew sling barbs at each other.",1
455021, Not your grandfather's 3~D.,1
213,It's a slasher film that only understands the simplest formula of the subgenre - stalk and kill - yet can't even execute such a minimalist horror architecture with staying power.,0
248350," You can only guess what the lines mean to the inmates, who register as atmospheric blanks at best and brutal exotics at worst, even if the tale that they enact with such earnest vigor works because the original tragedy does.",0
435582, Call it corny if you like -- and many will -- but Ross sees this biography ... as a chance to make a statement about the country's resilient spirit.,1
39669,"You watch ""Country Strong"" wishing you were watching ""Crazy Heart,"" and wondering whether Gwyneth Paltrow read the script all the way through, and wishing Bridges would turn up to show the folks how it's done.",0
151351," I looked at the ceiling, not casting my eyes heavenward for assistance but trying to find something more interesting to look at than what was on the screen. The ceiling won.",0
4608,"Far from blowing my mind, The Wolf's Call does what it needs to do, and surprises, in some ways.",1
25617," Paranoid anomie was just the thing in a post-Watergate world back in the '70s, and movies then reflected it. That makes this delightfully, unapologetically old-fashioned.",1
220687, So keen to be cute it curdles our stomachs and so anxious to be funny it jellifies our funny bones.,0
184062," Nobody does what Tarantino does, and that alone, in a world of copycats and sequels and rip-offs, makes him priceless.",1
148339," Despite the overdone stylistics in the film's final third, Sen-Gupta's dark dreamscape distills notions of vulnerability with gritty power.",1
4833,Nonstop fierce cartoon action with humor in crossover movie.,0
125328, A handsomely mounted but strangely prosaic period piece.,0
1963,The result is predictable: Rovira's film highlights the talent for set pieces more than the narrative muscle. [Full review in Spanish],0
201748," No money should ever change hands in any Gone-related interaction, unless it is because you are buying matches and gasoline to set all the copies of it on fire.",0
43729,"Forever typecast as nutjobs and con artists, Dern's Woody Grant is a little chubby, a little bewildered, and a lot unkempt. He's grizzled, resigned, and wonderful, and so is the film.",1
248511," The Internship doesn't break any new comedic ground...But it's an amiable, occasionally laugh-out-loud fish-out-of-water tale that gently mocks our modern technological age while simultaneously embracing it.",1
370434," Perkins' joylessness weighs down a film already heavy with a sepia-toned palette and filled with dust motes and rain, its Depression-era look turning into actual depression.",0
44051,The movie fails to portray its literarily talented and notorious subject as anything much more than a dirty old man.,0
