,Review,Freshness
23491,"A film that actually feels more modern than most of what we see nowadays, sixty some years later.",1
45002,"The overly hypothetical, weakly ambiguous I Origins gets tangled in scientific gobbledygook from which it never escapes, with no actual implications about identity.",0
399128, Eye of the Beholder suffers from blurry vision at best. Don't let your eyes behold it.,0
22031,"It's left to Barbra Streisand and Dustin Hoffman as Greg's parents to warm up the picture, and they light it on fire.",1
4210,"And while the actors do good work, nobody is really stepping outside their comfort zone here. Neither will white audiences be pushed anywhere they don't want to go, or haven't been already.",1
3555,[Director Ben Hernandez] Bray wants the film to be another straightforward superhero empowerment narrative. But he keeps stumbling onto complicated questions he doesn't want to acknowledge or resolve.,0
54186," Bridges plumbs the depths of this alcoholic, his bloated body strewn across a sweat-soaked mattress, clinging to his whiskey bottle as if it were his momma ... it's a knock-out performance, devoid of all vanity.",1
474976," Tough gravelly voiced Al Pacino and Robert De Niro, playing NYPD detectives, are the selling point for 'Righteous Kill.'",1
447756," How far you enjoy Marshland will depend on your enthusiasm for the ritual of genre -- and, in particular, for the type of story where violence against women is mainly an excuse to probe the troubled souls of men.",0
2308,"Joe Begos' most visceral, toxic, and brilliant movie. [Full Review in Spanish]",1
300900," It's like a John Woo gangster movie that's been boiled down to the bones, matched well by the slinky, brazen electropop of the Shanghai Restoration Project.",1
5013,"Welding a Black Lives Matter message onto a time-travel movie with a tone somewhere between Honey, I Shrunk the Kids and Do the Right Thing makes this an ambitious flick.",1
3018,"If you're a 5SF fan you'll be glad to see all the gang here, throwing themselves into the film and obviously having a good time doing it.",1
4622,"Plus One is a hilarious and, dare I say, relatable take on the classic romantic comedy formula with enough sharp one-liners - particularly by Maya Erskine - to keep you hooked from beginning to end.",1
390235," From the very first shot, we are clued in that there are depths of strangeness to be plumbed in even the smallest and most banal interactions.",1
8973,[An] unimpressive outing from Zhang Yimou.,0
50267,"The new camp counselors are interchangeable with the old ones. Different faces, same basic people.",0
829,One of Scorsese's masterworks.,1
3596,"Inspired by a true story - yes, cataplexy is very real - from events in co-writer Chris Higgins' life, ""Ode to Joy"" is held together by an amazing performance by Freeman.",0
91374, Bier's latest film-which just took home the Oscar for Best Foreign Language Film-is not the strongest example of her considerable talent.,0
61676," The real fun here is in the three central performances, each of which threatens to steal the film",1
3196,"""Macbeth"" and ""King Lear"" didn't exactly stick to the historical record either, and Ben Elton's speculative screenplay finds poignancy and wit in this unauthorized and unexpected portrait of Shakespeare.",1
4694,Anne Murugarren decides to face her reading of the text from the strictest literalness. [Full Review in Spanish],0
41495,"Part documentary, part fictional romcom, and all twee.",0
4281,Trespassers is a series of unfortunate events that leads its characters down a dark and twisted path.,0
43242,"Each successive revealed secret is less believable and yet somehow more obligatory than the last, because, after all, this is an old-school Asian melodrama.",0
199259, A strong contender for worst movie of 2015.,0
2748,"The script feels like it's been in mothballs since the term ""metrosexual"" was still a big deal in the mid-2000s.",0
5132,"It's terrifying precisely because it looks current rather than space age. We see ourselves reflected more clearly, and don't have the luxury of thinking that a futuristic setting means we have time to spare. Oh and the ending is a belter.",1
582,"This is about as optional as it gets...it's not taking up big screens for ""real cinema,"" but it's just there for people who know they enjoy this type of thing. It's very transparent.",1
427505," The Expendables is savage yet inert, and breathtakingly sleazy in its lack of imagination.",0
337170," Serenity knows it's trash, but that's not to say that it's not entertaining trash. But, still, that isn't enough for a recommendation. ",0
114,Jay and Silent Bob Reboot is essentially The Irishman or Avengers: Endgame of the View Askewniverse. A hardcore fans-only version of Kevin Smith bingo on the big-screen.,0
243206," Fans of the first two ""American Pie"" movies should definitely come back for a third slice. Everyone else might want to cautiously poke at it with a fork first.",0
37259," In Gosling's pairing with the laconic Crowe, it finds a genuinely pleasurable pair of losers trying hard to eke out a win.",1
88366," At its best, the film gets by on its striking imagery, from a panorama of sickening human decadence to a mid-movie retelling of the creation story that might make Terrence Malick weep.",1
414976," This taut drama exists in a timeless noir territory, a world of free-floating dread and dashed hopes where mood supersedes specifics of time and place.",1
2983,"Someone should start polishing up those Razzies for the Worst Film, Director, Screenplay and Actor of 2019.",0
65325," Dreamgirls may come up short in terms of originality and killer songs, but it wears its big, drippy camp heart on its sleeve.",0
45630,Some movies are train wrecks. This one is chum.,0
15693,May offend viewers not amused by the sick sense of humor.,0
159715, Solnicki gives a refined vision of formal precision and an enervating narrative brilliance that imposes a trance that suspends time and generates states of boredom or ecstasy. [Full review in Spanish],1
4516,"Only the latest in a long line of forgettable, unfunny ""comedies"" in which we're supposed to care about some intrinsically unlikable slob.",0
5715,A superior vehicle for Mae West.,1
27567,"Though the outcome is a foregone conclusion, this movie still delivers a thrilling ride.",1
106793, A distressingly lifeless concoction.,0
479037, [T]here's more testosterone in the Rock's goatee than in the testicles of 100 lesser men. ,0
58640," The doc is a bit more loony than the recent SNL film, but it's still just a bit too tame - i.e. lots of talking heads - to truly represent its subject.",1
344044," Director Jean-Marc Vallée and screenwriter Bryan Sipe are similarly heavy handed, bashing us over the head with symbol and metaphor long after we've grasped the point they're trying to make.",0
5158,It's a trite jumble that confronts its ripped-from-the-news theme as an impersonal check box.,0
20977,"The images are fresh and imaginative and yet perfectly believable, mixing the normal with the inconceivable,",1
5282,"[What Men Want] feels entirely more rote and uninspired, featuring few elements of genuine creative ambition.",0
4550,"This was a tough movie to sit through...this is a proper thriller, with each beat and moment landing...",1
335930," Proves well executed simplicity sometimes can be more effective than bombast, blood and things that go boom.",1
2071,"Not only is Toy Story 4 is the sequel I never knew I needed, it's quite possibly, the best Toy Story to ever be told.",1
4424,"There's a lesson here about the limits of permissive parenting, but it's mostly a Martin Parr-like evocation of a cartoonishly narcissistic time.",1
2967,"Overall, Bleed For This is an enjoyable film. Its third act makes up for a slightly sloppy start.",1
19424,"This has been clearly aimed at - pardon the pun - diehard action film fans. Anyone else, who might expect a vague sense of irony, will be sorely disappointed.",0
1869,"It all leads to one of the most disturbing, icky final sequences of the year, a tour de force of entomological terror that leaves enough unsaid to later linger in the subconscious.",1
4885," ""The Core"" benefits from the talents of its veteran ensemble cast",0
212366, It's [director Ryan] Coogler's personal touches and vision that elevate Creed from the ordinary. ,1
199312," Devoid of its milieu, the film kind of loses its punch.",0
37078,I can't think of a movie this long that has left me so starved for a movie.,0
115507, Marjorie Prime feels less true at every turn.,0
18028,"If they remade ""It's A Wonderful Life,"" they could make it about Spielberg being shown what American cinema would be like if he never lived - they'd show him this movie.",1
264622," It sort of sits in a blank, defeated slump.",0
181210," There are some nicely shot moments throughout, but they feel empty - slow montages that mostly just fill out the film's thin plot and already slim runtime.",0
20476,Terrible conclusion of the trilogy. The first two were great comic/cartoon adaptations. But back in time? What the hell is that about?,0
3881,An uneven but genial comedy that riffs on America's love of conspiracy theories.,1
38428,"Winslet and Davis are both so good, bringing genuine poignancy to the evolving mother-daughter relationship, that I found myself sucked into their strange world ...",1
934,"[The filmmakers] capture fear of the unknown, through the allegory of super-powered people, more succinctly and effectively than most of the ""X-Men"" franchise ever could.",1
295629," It's no compliment to note that with very little tinkering, Corky Romano could be a Martin Lawrence picture.",0
1538,"...keeps covering the same ground, and never quite tackles the root problems of this kind of aggression and how it's facilitated by online media.",0
381326," For all the hype, I fear this is a film that only the most uncritical Star Wars fans will truly enjoy.",0
4842,"A top notch crossover between two powerhouse series with action, comedy, and some epic fan service.",1
3188,It's almost like Shakespeare wrote this movie.,1
2595,"Improbably, Fessenden takes material that hews closely to Mary Shelley's classic and breathes new life into it, making a compelling, if a bit warmed-over monster movie.",1
48067,Demerits for the dull execution.,0
5116,"For every superlative I have for this movie, I feel like I should add the qualifier ""but ludicrous,"" while every complaint needs to be followed by an implied ""but satisfying.""",1
304098," Toothless is so vividly, viscerally animated, I worry a child will look askance at her own humble dog and peevishly wonder why Fluffernutter can't fly, or at the very least breathe fire.",1
45055,"Supremacy is, minor quibbles aside, a worthy successor to The Bourne Identity.",1
29216,The movie seems to lack a solid point of view; it basically offers a series of vignettes without any unifying theme or common thread - except that these adrenaline junkies in a foreign land drink and screw around a lot. ...,0
30298,"With an almost aching restraint in the performances and storytelling, Assassination makes for a quite enjoyable film if you give yourself over to its pacing and style.",1
403854," ...[Knoller's] portrayal of a person locked in his own grief is both realistic and sympathetic, and Fox brings events to a conclusion that is more than worth the wait. ",1
5257,"...an odd, philosophical smorgasbord of scathing themes that colorfully decorate this off-kilter social critique of underclass religion and repression...an ambitious, imaginative, and bitingly humorous cultural concoction of meager existences in Taiwan",1
2178,"Jamie Bell gives a pulsating performance in Skin as an American neo-Nazi who renounces all notions of white supremacy, to the vengeful fury of his former associates.",1
4845,"It would be welcome to see more movies between them in the same vein, even if Murder Mystery was a bit of an uninspired trek...",1
257,The setup at least allows for a bunch of fine actors to really chew the scenery during group therapy sessions.,1
29274,"While rarely dull, Whiskey Tango Foxtrot is forever changing direction.",1
33849,I'm not sure if everyone is just phoning it in or if they're genuinely trying to make a good movie.,0
478690," If a white filmmaker were behind the wretched ugliness that is The Wash, he'd be branded the most racist director since D.W. Griffith.",0
3394,The first act does work well but then the proposal is not satisfactorily developed. [Full Review in Spanish],1
155438," Bouchareb's WWII epic took more than a decade to make, but dealing with racism and injustice within the French army, is at once an impressive chronicle of a nearly-forgotten unit and a timely statement vis-a-vis the recent racial riots in France.",1
605,Daniel Isn't Real is a psychological trip that you feel genre cinema has taken before but there are enough stylistic flurries and touches here to make it a memorable film and one that only benefits from repeated viewings.,1
28906,"The slapstick here is nothing to rent the film over. Oddly, it's the serious moments that charm. I was embarrassed to myself for being choked up by Mel Brooks. ",0
408747," If you like cheesy 90's action movies like The Rock or Con Air, this is a movie you really need to go see with a bunch of mildly inebriated friends and just have some fun.",1
3517,"Trial By Fire is an expertly-crafted work of art that doubles as a biopic and perceptive, dual character study, brimming with jaw-dropping performances led by the versatile O'Connell.",1
415092," Mildly entertaining with great production values, exhilarating musical numbers, and a lively supporting cast, but it lacks the heart and soul of the classic 1991 animated version. ",1
28434,The spacious but authentic location shots set the mood for the danger that awaits the two innocents.,1
12486,"The ideal village-picture fable, as fascinating for its innate mythology as for its ethnography.",1
1725,"You just cannot help but think that they thought it was a good idea at the time, started rolling and realised it was too late to rethink",0
144553," It's the cumulative effect generated by mixing richly portentous imagery with absurdly portentous prose, starkly portentous sound and flatulently portentous music.",0
26736,"Bloody to the point of gruesome, moving without being inspiring.",0
2205,"Despite the eerie setting and some visual flair, In the Tall Grass struggles to keep the viewer invested and fails to be particularly scary.",0
35926, Moore gives a controlled portrait of emotional implosion ...,1
10265,It really does get better - at the movies anyway.,1
51438,"For all its capacity for follicular detail, this cool new technology has trouble with intimacy.",1
136149," I got tired of this joke before the movie ended, but I appreciate the gusto with which the filmmakers -- particularly Coffin, with his nimble vocalizations -- carried it out.",0
38089,"With a project such as this, it's the two central performers who should run with the ball, and they both come through like champs.",1
99862," More a return to roots than a return to form, this messy carnal-concussion comedy celebrates the libido and every form of sexual practice",0
3124,"Unintended silliness makes young Joan look foolish for being entranced by them, robbing her of agency when the film is desperate to prove the opposite.",0
19912,This film has no idea what tone it wants to strike... none of the more sincere messages land because the film's depiction of its middle eastern characters is grossly one note.,0
309849," Most of the effort seems to have gone into the original music, which is pleasant but not memorable, and too little on creating believable, multidimensional characters.",0
434115, The film's Capraesque centerpiece is built from a series of fuzzily developed narrative threads and flip pieces of ominous detail.,0
3553,Brightburn takes a cool premise and executes it in a blackly fun but nihilistic manner.,1
4367,"Burn Your Maps is filled with adventure and a whole lot of heart. The plot is a bit too fantastical, but the strength of the performances grounds the narrative when needed.",0
28499," A woeful script that wastes a wonderful leading man, this is a film that doesn't care about anything. At the end of 93 minutes, neither will you.",0
950,"Prepare to laugh, suffer and not take your eyes off of it. [Full review in Spanish]",1
27379,"The real headline is Coppola herself, though. I may not love Palo Alto but its substance and style are singular enough that I am keen to see what she does next.",1
38872,Ultimately it's Mara who has to pull it off and deliver Lisbeth's unique brand of cunning and power fueled by revenge. She's a knockout.,1
305753," Designed to please all generations of irreverent humour-lovers, The Pirates! Band of Misfits may not be heart-warming (it is about nasty, scurvy pirates!) but it's breezy rollicking fun.",1
80974," Where another filmmaker might have revelled in Uncertain's poverty and crime statistics, these directors find the sweetness in the saltiest of subjects and majesty in infested waters.",1
78641," See it with a crowd, laugh yourself silly, and feel slightly ashamed in the morning.",1
6360,...an above-average neo-noir...,1
41046,"A deeply spiritual movie about the moral complexities of helping another person, opening one's heart, feeling the pain of another, and letting go of the need to fix that person but instead to simply be present in love.",1
285320," If Day-Lewis isn't front and center, the film drags with themes such as oil vs. religion, and greed is always around...",1
76834, Women Who Kill is a smart comedy about the fear of finding oneself vulnerable. ,1
7019,"This film has an ear for the way moms talk to kids, a sensitivity to drug-sweetened intimacies, and an appreciation of the urgent nuance, not just the comedy, of recovery-speak.",1
4733,I had fun anyway.,1
2124," Wildly inconsistent in tone, it is impossible to know whether the film aspires to comedy; it's certainly not funny.",0
349180, Stephen Maing's documentary about the NYPD's illegal policing quotas and other discriminatory practices gets the blood boiling.,1
38534,"The crisp black-and-white cinematography is the stand out, hugely benefiting from filming on location.... Adding to the melancholy is Miles Davis' sparingly used score.",1
3024,"Moments of hilarity remain, and the picture is inventive in its adoration for the excesses of the genre and the world of VHS recording.",1
44553,"Eastwood is making a point here about the heroism of ordinary men, the grit behind seemingly banal bros, though it's one of the oddest and lowest-key films he's ever made.",1
51280,"It's an experience, rather than another helping of the same old thing.",1
2736,"None of the filmmaking or acting really conveys that wonder of discovery; of falling in love. It's a facsimile of that feeling; a not-so-cheap copy. And, weirdly enough, it inspired in me only a small sense of loneliness.",0
34169,"At its best, The Hand That Rocks the Cradle is a bright, nasty psychological thriller with a joker up its sleeve.",1
26113,Stillborn,0
67987," Runner Runner"" is a lifeless dramatic crime thriller that is never able to wake up from hibernation. It's like a tasteless alcoholic concoction that no amount of shaking or stirring could possibly add any sort of flavor to. ",0
1408,Cold Brook is an adult fairy tale that embraces its broad interpretations to remind its leading men about what truly matters most.,1
304250," A funny, sprawling romantic comedy that attempts to say something significant about relationships. Occasionally, it has the ring of truth.",1
2393,Wang spends much of the film flailing for a direction or emotional center for his story and comes away confused and empty.,0
340494," Agreeable comfort food for the multiplex masses, showing amazing fidelity to franchise tone after an extended break. Fans should be pleased with this reunion, even if it's lacking overall snap.",1
3937,"...DeadTectives is a solid horror comedy that is a perfect watch for fans of ghost hunting reality shows, Scooby Doo, Ghostbusters, and genuinely just any viewer looking for strong belly laughs in a common premise with a unique spin.",1
3508,Excellent performances by Laura Dern and Jack O'Connell lend credence to this message movie.,0
2048,A diabolical film. [Full Review in Spanish],1
2093,"Michel Ocelot's combination of live film, photo-realistic images and animation brings out the magic of Paris as if were being seen for the first time.",1
3520,"For all its strengths as a film, we still don't know any more after watching Charlie Says than we did before.",0
9045,"Let me pull out my crystal ball: ""Hereafter"" is intriguing in a lot of ways, but not a ""Million Dollar Baby."" ",0
1891,It may not be the most original single location thriller you'll ever see but it is certainly one of the most tense and engaging.,1
917,"[F]or those who followed the British period TV series which ended in 2015, there is plenty of nostalgia and fan service.",1
101310, A very dumb thriller that has deluded itself into thinking that it is a lot smarter than it actually is.,0
2710,"A stupendously dull series-ender without a shred of wit, narrative thrust or genuine emotional force.",0
42,The director's commitment to restraint and his strong attachment to social reality is remarkable. [Full review in Spanish],1
2761,"Given the vastness of the label's history, Huber does manage to cover a lot of ground in its relatively brief runtime.",1
29339,Annette Bening's talent is overwhelming... [Full Review in Spanish] ,1
261458," Its essential strengths are more dramatic and emotional than topical or satirical. Truman is a touchingly gallant creation, the hero of someone else's existential burlesque.",1
9463,There's enough of a storyline here to keep younger space cadets moderately settled.,1
17615,Lazy but funny.,1
264602, A dash -- only a dash -- of Tim Burton ghoulishness might have helped. ,0
232734, This series of films hangs entirely on the shoulders of a fully formed digital character. It's a remarkable bet... and resulted in what is pound for pound perhaps the best modern trilogy since the Lord Of the Rings.,1
30958,"It's frustrating, but it's real.",1
47361," Compared to other Young Adult adaptations the Hunger Games films are undeniably the most mature and well-acted, digging deep into the emotional and political core of the books.",1
308097," A Twelve-Year Night slowly digs a path into the heart of the spectator, in a successful integration of prison drama, historical reconstruction and a message of unwavering hope. [Full review in Spanish]",1
16837,"Jack Goes Boating is an impressive display of Hoffman's work. As an actor, and director, Hoffman always recognized the power of restraint to create a memorable impression - albeit, in this case, not one that leaves behind an indelible trace.",1
1693,Certainly the blue-chip cast that has shown up to support Murphy in the buoyant-but-superficial Netflix biopic Dolemite Is My Name is its own tribute to Moore's intersectional significance...,1
288442, Blake Lively is lively in this original with nowhere to go love story. Not much else is. ,0
3011,"Burr has the gift of being surprising, of resuscitating a done-to-death subject... Still, some bits work better than others.",1
4966,Isn't It Romantic is an adequate homage to the meta-send-up genre.,1
19,"This is just wonderful, but you have to stick with it because it's coming from a bit of a sideways place.",1
50866,"By keeping the parody and humour so tightly focussed, they've generated more laughter than any other filmmaker this year.",1
37529,The plot has been awkwardly repurposed for the Cloverfield universe-the focus-grouped seams are everywhere apparent.,0
5117,"Aspires to be nothing more than a bit of glamorous nonsense, but although it has done all right by the glamour, it has perhaps done too well by the nonsense.",0
240219," There's a political and social clash at its core, but the laughter comes from a deeper, human place (see title).",1
38200,"Aside from a few neat flourishes, this is attention-sapping stuff, lacking texture in both its visuals and vocal performances.",0
209656," Force Majeure is at once a finely-honed dark comedy and a character study of a family in turmoil,",1
9896,"A watchable drama with likeable performances but it never quite comes together, thanks to an unfocussed screenplay that stumbles badly in the second half.",0
22277," Besides a few random moments, Species just doesn't make the grade and also manages to waste a fine cast along the way.",0
14682,An intelligent slow-burn thriller. Philip Seymour Hoffman knocks it out of the ballpark. Your patience will be rewarded. It wouldn't be surprising if he were nominated later this year for a posthumous Best Actor award. ,1
27666,"Valkyrie isn't a great war movie, but within its own limited ambitions, it is enjoyable and never dull.",1
5393,A powerful story in which the filmmaker starts from material that's not his own and the result doesn't seem to evidence too much synthesis ability. [Full review in Spanish],0
2762,"Anyone who has a real love for music will want to see and learn from ""Blue Note Records: Beyond the Notes"" and the many amazing talents those two old white German Jewish immigrant refugees brought to us all.",1
28232,A quietly powerful and absolutely charming drama.,1
56013, Don't miss this sleeper pick.,1
7280,A two-hour comedy with only two good jokes in it.,0
314471," If the fallout from selfless heroism is tough ground to navigate, the Iraq War drama ""Thank You for Your Service"" boasts experienced guides in Miles Teller and writer-director Jason Hall.",1
5270,"Cinematography is so ""folktale gorgeous,"" fully realizing the maddening effects of isolation (much like THE WIND/THE WITCH). A deeply, destructively disturbing taste of pagan witchcraft horrors.",1
