,Review,Freshness
2188,"Forget tales of drug-addled footballers and former All Black first five-eighths, this is the sporting documentary you need to see right now.",1
382078, Music and cinema are both universal languages. I can't think of another film that blends the best of these audio and visual worlds into a most enjoyable adventure about mixed cultures and disparate lives that becomes the sum of much more than its parts.,1
52036,"Oh, what stupid people these are.",0
5245,Good Sam explores whether it's possible to find a person capable of doing a good deed selflessly. What unfolds is a heartwarming mystery about unconditional generosity.,0
11792,Lessons learned: Never underestimate the creativity of a wronged West Virginian with access to barbed wire.,1
4659,"Captive State is a frustrating movie: it could have been one of the great sci fi surprises of the year, unfortunately it didn't live up to its own ambition. [Full review in Spanish]",0
14938,"A classic. Funny, great special effects and a cultural phenomenon.",1
925,"Newbies will still be able to enjoy the lighthearted fare however, those familiar with the series created by Julian Fellowes will benefit the most. A real treat for fans.",1
34670,"Rates an L for laziness, as none of the characters is developed beyond the broadest archetype, nor are their motives probed beyond the flimsiest of excuses -- nor is the heist itself more than a mountain of ridiculous improbabilities.",0
3273,"The thrill of seeing good thieves at work, combined with the leads' chemistry and the tension building score, make for an enjoyable, if shallow, film experience.",1
235474, The Answer Man is one of those modestly diverting motion pictures that's as sweet as cotton candy -- and as insubstantial.,0
1159,"Some violence, teen drinking in drab horror movie.",0
38934,"Ultimately, Memoirs of a Geisha compares unfavorably with the book, though it offers pleasures of its own.",1
273208," Kids will lose their minds at the sight of Fraser in a skin-tight pink tracksuit with the words ""Yum Yum"" on his sizeable backside. Parents will sigh and eat popcorn.",0
99084, Michael Mann shows some restraint and comes up big with this one.,1
119235," Though the romantic triangle provides the story's heart, it's the film's take on media as social control (Stanley Tucci returns as the unctuous TV host), sharp sense of action, and smart peformances that give Catching Fire its soul.",1
159185," As a piece of cultural criticism, however, it painstakingly eviscerates nearly every scene in ""Grey"" and skewers latent sexism, classism and ludicrous sexual innuendoes, as well as the original's numerous plot holes.",1
369116," It's Complicated is the best middle-aged romcom since Julie & Julia. If you loved Streep in that or Mamma Mia!, you're also going to like her a lot in this.",1
377505," Beautiful Boy is an attractive and always-watchable film. But considering the ugliness of its subject matter, I'm not sure that's a recommendation.",0
1902,"As a whole, 3 From Hell was still a lot of fun and it feels like Zombie has grown a bit as a visual storyteller to boot.",1
7057,It is hard to know what kind of audience this film was made for.,0
4502,"While there are cliched moments and the odd didactic part, the film overcomes these issues thanks to strong characterizations and great performances.",1
383304," There are amusing moments here and there and John Ritter offers an ingratiating performance, but that's about it.",0
4558,"These recreations often times serve to shed light on ways to react and to proceed in the face of a catastrophe. And in this respect, The Command falls short. [Full Review in Spanish]",0
15178," The end credits, which seem almost as long as the movie itself, dementedly thank everyone from the citizens of Pennsylvania to William Wyler, Howard Hawks and God. What an insult.",0
5402,"After years of doing it tough, jaundiced detective Brett Ridgeman proposes that he and his partner become partners-in-crime by ambushing and robbing a dealer.",1
14801,"With only one member of its love triangle really delivering, this packs less of an emotional punch than it ought. And who'd be a courtier, eh?",0
192001, Thor: Ragnarok is everything that you want a Marvel movie to be. ,1
42047,"Yes, the film is built on deceptions, and yes, it features a series of interconnected twists, but like all good movies and magic tricks, it doesn't lose any glory in a repeated performance or viewing, only gains it.",1
4870,"Hotel for Dogs"" is naturally attractive because of the sheer number of dogs in the film, suitable for any dog lover such as myself...",1
101127," I don't trust Moore's editing: Who's to say the man photographed scowling during a Moore paean to Hillary Clinton wasn't filmed at some other point in the evening, actually frowning at something else?",0
3035,"The vocal talents are so good, the only things you really wish for through The Secret Life of Pets 2 are better lines, a few more sight gags featuring cats and laser pointers - and maybe a little less Hart.",0
2495,"Despite my inability to understand some of the dialog , and the fact that I'm not a fan of this kind of music, I enjoyed the film. It is well written and acted. Director Tom Harper also helmed another of my favorite 2019 films, 'The Aeronauts.'",1
1980,"As in the so-called ""best series in history"", the engine that puts this story into operation is a script that gives no respite and equips the characters with a humanity as brutal as it is heartbreaking. [Full Review in Spanish]",1
33818," Run, Fat Boy, Run shows that Simon Pegg can't rescue a derivative dud.",0
253221, ... a respectful tribute to the extraordinary life of a couple that can motivate many with their story and strength. But it is also a melodrama... [Full review in Spanish],1
7430,"Anyone interested in an early visit to Purgatory is directed to this excruciatingly unfunny, frequently repulsive movie.",0
1193,"Almost 20 years after the much-loved animated series Dora the Explorer debuted, this live-action update does a terrific job of at being once a homage and a parody.",1
7259,"The problem isn't just that MacFarlane is a bad actor, but that Anna's character makes absolutely no sense.",0
41989, There's a lot that works in Heartbeats -- so much that its flaws stand out in disappointingly sharp relief.,1
11507,"It exists largely to entertain and delight, which used to be precisely what summer blockbusters were engineered to do.",1
5137,It's a film whose cast is utterly sweet and lovely to look at even if the movie feels incredibly thin.,1
977,"With this semi-autobiographical film, Hari Sama recreates the changes that emerge in such a transcendental moment for Mexican culture. [Full Review in Spanish]",1
195960, A glossy and admirable condensation of the immensely popular novel...,1
299787, .Roman J. Israel's inability to find narrative propulsion and tonal consistency is even more disappointing in the context of Nightcrawler.,0
4339,"<p>
<em>Quote not available.</em>
</p>",1
31309,"The direction of the film is so matter-of-fact, the storytelling so obvious, the lack of nuance so palpable, that it seems to actually take its alarmist and patronising attitudes towards change at face value.",0
77209, Neither a glimmer of satire nor gram of wit animates Dennis Illiadis' 109 minutes beside the lake.,0
183,"There are missteps here, but the combination of Justin Long and the overall vibe wind up saving the day, especially when mixed with some of Klabin's visual stylings.",1
2024,"[It's] the trust one has in the director that allows oneself to be ""cheated"", in a good way. [Full review in Spanish]",1
36953,"Harry Potter and the Chamber of Secrets is good enough to satisfy hard-core fans, even if it falls short of being truly transporting moviemaking.",1
322158, May have been filmed in a new process: Pectoralscope.,0
226834," The film wants to be taken seriously, its earnestness only ever fleetingly successful at being a critique of our perception of it.",0
446751," This is a lovely, delicious film with fine acting and a unique plot.",1
37490,"As a look at two women who find an unusual connection, it's rather beautiful.",1
50594,Mr. Williams latches onto every cheap laugh he can find.,0
12328,"Tough and relentless, dazzlingly researched and crafted.",1
28009,"Another gentle charmer from the ""Wallace and Grommit"" folks.",1
51571,It's clear that no one's creative juices were really flowing on this project. Not even trickling.,0
183020," In The Court Jester, Funnyman Kaye takes all the laughs he needs, but he takes them when they do not stop the show. ",1
1227,"Nick Nolte is perfectly cast as Mike's ""off the grid - antigovernment"" father.",1
4087,"The film takes some familiar genre elements and mixes them up a little, delivering something that feels fresh, occasionally subversive yet -- at times -- as moving as it is outrageous. It's a comedy with plenty of smarts.",0
204370," The film treats its women with respect and insight, and the relationship of Binoche's and Stewart's characters has a depth and nuance almost never seen in mainstream cinema.",1
591,"If there is a meaningful difference between performing and acting, Joaquin Phoenix surely exemplifies the former here, creepily contorting as the Clown Prince of Crime in Todd Phillips' timely, toxic take on the Making of a Murdering Madman.",1
2982,"Broadly sticking to the boxing movie blueprint is forgivable, Teller failing to properly sell the struggle of a man whose livelihood and reason for living is almost ripped away from him isn't.",0
3542,"A predictable yet entertaining, gleefully bloody exploration of evil finding its way in the world.",0
2382,"Rubin works well with suspense and while detailing inmate horrors, wisely spending little time in the Middle East to survey a slightly different War at Home scenario.",1
1103,Big Yoga is having its reckoning moment. And the Bikram documentary is the capstone.,1
292287, What makes the film so powerful is how Tarkovsky's vision transcends the mere people politics of its frame to conjure an idea about Russian history and the transience of man.,1
5050,"By tying it back to characters that don't seem popped from any too-familiar mold, the film allows its sense of regret, its alarm at time passing, to feel earned.",1
84421," Give it your all and you can lose it all-that's the lesson, accompanied by the frenetic Philip Glass-like string arrangements that have become de riguer in the now ubiquitous genre of tortured-chef portrait. ",1
11458,"After this lackluster outing, the thought of a sequel is a stretch even Mr. Fantastic might not be able to make.",0
3410,"At a time when bigger is automatically assumed to mean better at the cinema, these con artists hope that going small is the path to a big payoff",1
178417, The animation is spectacular and the action full on. The monsters are cute and lovable even though they're still pretty ugly.,1
3841,Poms manages to be a decent feel-good movie. [Full review in Spanish],0
23661,"In his feature debut, director Roman Coppola brings visual flair with an infectious kitsch quotient and an assured dramatic sensibility.",1
1813,Making Montgomery Cliftis a highly personal endeavor that should be of interest to any film buff. It leaves some questions unanswered but paints an admiring portrait of a singular talent. It's available on VOD right now and well worth seeing,1
3424,More intimate and dramatic than an action or suspense [film]. [Full review in Spanish],1
40584,"One of the first movies to parody gangsta rap, it does so knowingly and affectionately.",1
39164,Criminally lazy follow-up to the syrupy family comedy Daddy Day Care.,0
161115," Should thrill, challenge and provoke audiences ready for [Scott's] signature brand of intelligent and visceral film-making.",1
267157," A dramatic-supernatural escape that, rather than scaring you, it will make you sleepy. [Full review in Spanish]",0
361828," Miscalculated at every level, it's a vacant drama full of ineptly drawn characters.",0
401017," If you can't deal with really dirty language and insanely filthy slapstick-ish comedy and lots of drawings of the male sexual organ, then you shouldn't see this movie. But you'll be sorry.",1
215596, Won't you see one of the best documentaries of the year? Sure you can.,1
425382," A slow, melancholy tale of murder of how it pays to be rich if you want to get away with it.",1
7480,Writes a new chapter in the heist genre while showcasing great new talent.,1
6918,"This is an unoriginal, dull-witted, juvenile, crude, offensive, idiotic and pointless romantic comedy that makes no sense. None.",0
1782,"Despite the risks Eli takes, at its core the movie is not very good. The performances are expected but competent. The scares are hollow jump-shocks where the score tells you precisely what's coming next.",0
24475,Just as entertaining and as visually attractive as the five previous Bond films.,1
264664," It works, because it is now what it was then: a triumph of the imagination.",1
423205, This is just a waste of time.,0
160432," ...looks and sounds more like a raunchy, worn-out television sitcom than a Farrelly product.",0
44944,"There are far too many times when the story simply looses its footing and falls into another tedious direction, leaving some angles completely dangling.",0
357786," [Araki] made The Living End, Mysterious Skin and other anthems to gay America. Kaboom is less an anthem, more a discordant impromptu.",0
2656,A simple and effective bloody exercise in the old-school tradition of the slasher. [Full Review in Spanish],1
3110,"Instead of focusing mostly on the budding relationship between the two leads, the movie throws in useless subplots and needless distractions when all we really want is to see Grant and Bullock fall in love.",0
27267,"It may be silent, but The Artist earns some very loud applause",1
31207,"The skeletal story of The Rover is a case of too much bone, not enough meat. ",0
143978," There is a host of ensemble actors who add nothing to the film's humour quotient, and saunter in and out of the screen with no purpose.",0
11425,"Fantastic Four is anything but, and should serve as an indication that maybe its time to put the brakes on the current avalanche of comic book adaptations.",0
265388," Instinct is the second one in a row that Gooding lifts out of mediocrity by the sheer force of his talent, intelligence and personality.",0
407992, The subject matter of LXG demands an intelligent approach... You simply can't marry such a literary conceit with the simplistic needs of an event picture.,0
1260,"As calculated as the film might be, it's hard to dislike. And while Nilson and Schwartz use Gottsagen's sincerity as a guarantee of their own good intentions, this never feels as exploitative as it might have.",1
40266,"Long before the end of the film, you'll wish you'd followed the example of the baby moose that, early into the proceedings, chewed through its rope and wandered off.",0
2399,"Ultimately, Spider-Man: Far From Home is a fun, energetic, and entertaining blockbuster, and far better than what's been in cinemas these last two months.",1
2428,"Raiders of the Lost Ark has it all -- or, anyway, more than enough to transport moviegoers back to the dazzling, thrill-sated matinee idyls of old.",1
3085,"In the end, Tone-Deaf proves to be a film that largely lives up to its title.",0
12399,Mars Needs To Work Out How To Animate Humans So They Don't Look Like Possessed Shop Window Dummies.,0
3912,"You just have to go with it, but Above the Shadows will reward you for that journey.",1
11250,"'A new action hero is Bourne.' As incredibly cheesy and precious that advertising tag line for The Bourne Identity is, there's no discounting the truth it does hold.",1
4826,Politics for De Palma is a bizarre excuse for exploitation. This is one of his films in which he spares no one.,1
235336," This is one of those sequels that for security purposes, is affraid to adjust or change anything from the original formula. [Full review in Spanish]",0
405816," You can tune a piano, but you can't tuna fish even when Matthew McConaughey is steering the boat in this M. Night Shyamalan wannabe that feels like one of the actor's Lincoln commercials. Ambitious and commendable but poorly executed. ",0
1979,"Except for the enjoyable nostalgia that swells in the form of throwback cameos, Vince Gilligan probably should've left this one alone. This movie may have sounded good in theory, but turns out it's far more story than anybody needed or wanted.",0
391,"It's a ride that opens the door to a diverse and important community. With wonderfully raw and absorbing performances, this small tale is a rare treat.",1
7665,Lovely performances elevate this predictable drama.,1
727,It doesn't matter how much of the story is true because the film is the real deal.,1
2613,"[The] script isn't groundbreaking, but first-time feature director and co-writer Matt Kane and co-writer Marc Underhill present some compelling enough questions for audiences to ponder about the ethics of AI.",1
741,"Two in the Bush mixes comedy with deeply emotional moments. The result is highly relatable content which one can identify with whilst laughing at how ridiculous humans can be, specifically when dealing with love.",1
1164,An innovative blend of animated storytelling and traditional documentary.,1
50423,Has a promising premise.,0
103843," The action is why you come to this movie in the first place, and I liked all the fight scenes I saw...right to the cusp of fresh, but I cannot call it a fresh picture.",0
4904,Scorsese seems to intrinsically understand the revue's ethos. Hence the intuitive decision to make the execution of his film an aesthetic mirror of the tour it documents.,1
3680,"While the design is visually striking there's nothing beyond the paper-thin, by-the-numbers nature of UglyDolls.",1
304833," A special-effects monster movie that's a deliriously loopy combination of the Underworld films, the Highlander franchise, and a brick of Swiss cheese.",0
81161," It's vulgar and raggy, but also very funny.",1
28313,Movies such as Girls Trip challenge the confines of the ways women are allowed to be funny-especially Black women.,1
152157, Why is The Brave One so much less satisfying than Death Wish?,0
50933,The movie will happily repay multiple viewings.,1
20655,"At times the structure labours, but ultimately Fanboys rises above routine Hollywood fare because it never makes fun of the people it represents.",1
5223,"It's American Beauty meets Dead Poets Society given a terminal-disease twist, and while not as scathing nor as inspirational as those films, The Professor happily mines laughs from the darkest of places.",1
42940,"If you've seen the original, there's absolutely no difference in what happens. And very little reason to check it out.",0
29596,"This is a remarkably inert movie: unscary, unexciting, and so obvious that it announces how obvious it is going to be in advance.",0
2564,"Overall, Corporate Animals suffers from an imbalance of predictability and creativity. It has some hilarious moments but ultimately, it feels like a missed opportunity.",0
12165,A misshapen mess which relies on shameless manipulation and cute casting to cover its lack of a plot and phony emotions.,0
4496,Beats is a classic case of extraordinary acting saving a movie from its script issues and boilerplate story beats.,1
467127," The movie falls into some of the pitfalls of telescoping events to fit the format. But it heroically depicts the Queen era (late '70s-early '80s), and the band's phenomenal creative energy and output.",1
26577,"If you relish the sight of a healthy male body being systematically demolished, beyond the farthest reach of plausible endurance, The Passion of the Christ is your movie.",0
5538,"I'm glad what will inevitably be referred to as ""the Netflix weed doc"" is largely about the war on drugs' outsized effect on radicalized communities and the current intense discrimination with regards to the burgeoning legal market.",1
289555," Though this drama by writer-director Brian Koppelman hardly measures up to Wonder Boys, it comes a lot closer than King of California.",1
30567,"The Incredibles is the finest of Pixar combined with the best parts of Spider-Man, Superman and Batman...plus it's pretty damn funny too.",1
27216,"If you want to see some spectacularly adorable if not particularly lasting or memorable dog tricks, The Artist is the film you've been waiting for.",1
38073,"A feast of fangs bared acting by two exemplars of the form, John Malkovich and Willem Dafoe.",1
39629,... wallows in the weepy glitz of country music ... without once tapping into its true grit.,0
1255,Official Secrets offers a relevant and cautious story about the ramifications of going against an institution. [Full Review in Spanish],1
26692,No other film in history has even attempted such a concentrated interpretation of these unimaginable events let alone do so with what I call such reverential explicitness.,1
23547," Comes off as serviceable at best and officially sanctioned fan wankery at worst. In trying to freshen up the ingredients for a new generation, it just clunks up the batter.",0
1907,Builds on the foundations of the previous films whilst taking new and unexplored directions.,1
114216, Awkwardly paced and muddled.,0
4364,"Solid, unsurprising, formalist filmmaking of the kind we've come to expect from Clint Eastwood.",1
440608," Awful, but memorable.",0
2334,Bachelorettes is better than most of what's out there because it challenges the audience to analyze themselves and empathize with the female experience. [Full Review in Spanish],1
5082,"Until now, the documentary 'For All Mankind' (1989) looked to be the definitive word on the 1969 moon landing, but this one easily tops it.",1
16646,"A lot better than the Muzak it threatens to be, but, ultimately, not good enough to keep our itchy fingers off the dial.",0
33950,"The Predator still isn't able to quite recapture whatever magic in a bottle the original film created, but it is able to make for an entertaining enough sequel.",1
54371,An adventurous ode to growing up.,1
52162, crammed with near-campy moments and dialogue that often suggests 'The Young and the Restless -- 1200 B.C.'... ultimately seems as inauthentic as a gyro from Taco Bell.,0
33705,"Boseman captures his subject's voice and mannerisms, but perhaps most appropriately, he finds his soul.",1
1891,"Might at first look like proper cinema red in tooth and claw, but underneath it's a bundle of matted fleece and bleating.",0
202393," A facetious yet sincere documentary that makes the case for why all of the world's organized religions are not only, well, ridiculous, but also detrimental and downright dangerous.",1
464998, Simultaneously nasty and painfully dull.,0
6005,"High school... Vanessa Hudgens... kids making music. We know what you're thinking, but you're wrong.",1
26310,"Anyone who has experienced the flush of first love will relate, but the fact that the film is specific and detailed both emotionally and physically in its portrayal of a gay relationship makes it a standout.",1
476534," There's something so unforced about him that it can seem as if he's not delivering a performance, just being Tom Hanks.",1
54274,"Some things you probably won't care about in Snakes on a Plane: character development, the musical score, harsh lighting that makes everyone look like they're wearing wrinkle-enlarging cream. Here's what you will care about: It's a lot of fun.",1
5131,A strange and unsettling sci-fi which has a rather bleak outlook on the future of humanity.,1
1853,"[For] those willing to take the plunge into the animalistically risqué unknown, The Death of Dick Long gallops to the finish line with authoritative tenacity.",1
396208," In Obvious Child, stand-up comedian Jenny Slate plays stand-up comedian Donna Stern, a Brooklyn hipster who puts absolutely no filters between her most intimate, embarrassing thoughts and her shtick on stage.",1
403976, [The movie] makes us feel small and gives us the thrill of what it would feel like to be that tiny. It's a cartoon take on Gulliver's Travels - which is the delicious gimmick at the heart of the Ant-Man franchise... and impossible to resist.,1
108372, Million Dollar Baby is one for the books. It could have gone wrong in ways that would reduce it to a series of stereotypes. But it never does.,1
125143," Even when Buster Scruggs isn't firing on all cylinders, it remains a warm and cheeky tribute to a genre that the brothers behind True Grit and No Country For Old Men clearly love.",1
354898," More impressive than its ecologically minded message is its modestly profound portrait of loneliness, obligation and the desire for reciprocated affection.",1
3091, A film that comes across more like a narrative thriller than a documentary. Effective criticism of America's current global military adventures.,1
46070,"It takes more than a few lines of clever dialogue, a hero who reads books, and an actor with British training and lots of dignity to keep a movie from going pretty much by the book.",0
37514,A great attempt at reviving a sci-fi franchise that centers Black people and people of color in prominent roles. ,1
3108,"It felt decidedly new, from the pair of friends at the centre of the story to the celebration of female intelligence, ambition and loyalty.",1
354158," It's almost like the movie is afraid of what it should be -- a young, frisky love story that should be exuberant and carefree, even if it means risking making a fool of itself. What's love, after all, if it doesn't do exactly that?",0
321556," Embora não seja engraçado como acredita ser, a honestidade do roteiro em sua frustração com a futilidade contemporânea é algo refrescante em meio a tantos projetos sem personalidade ou ponto de vista.",1
