,Review,Freshness
258266," It took a lot of bravery and candor to put this story out there in any form, and for that, [Sarah] Polley deserves all our thanks and respect.",1
27084,"For all of the massive sets and overstated rumination on the design of the universe, ""Agora"" is film that fails at every step to be believable.",0
238856," Their Reservoir Dogs-a multi-character story ideal for brothers-is a lovely homage, the 'Stuck in the Middle With You' torture scene a standout. ",1
1482,"The tension builds, the special effects are gruesome, and most of all the film is fun for both young and old moviegoers.",1
190724," Pleasantville seemed to say that such squeaky clean living is unnatural and unsustainable. Blast probably aims lower than its counterpart, but it came closer to its mark.",1
116135," The Most Hated Woman isn't a documentary, and it certainly isn't pretending to be perfectly historically accurate. It does, however, draw out some of the real underlying issues still impacting politics today.",1
5396,"JT LeRoy is a decent telling of a fascinating, resonant true story. If it never really fulfils its promise, it's worth it to see two major talents - Kristen Stewart and Laura Dern - in full flow.",1
3711,It's a strange and enticing mix: a superhero origin story and sci-fi paranormal effects mix with apocalyptic allegory.,1
35733,"A second look reveals everything wrong with the movie, but on first pass, it's well-performed and enjoyably crafted.",1
116671," What happens when a seemingly righteous operation goes wrong and anxiety threatens to overtake ideals? It is the question ""Night Moves"" asks and answers in chilling ways.",1
6678,"Beautiful in practically every way, Carol is a touchingly romantic triumph.",1
167419," As a patchwork of historical fact and anecdotal evidence, it is at least very colourful.",1
15444,Mystic River draws its power from the shadow murder throws over everyday life.,1
279280, All the buzz in the world is not going to make the latest incarnation of the beloved 75-year-old radio/serial/comic book legend a fond memory for many viewers this month.,0
3216,"With an authenticity rarely seen in contemporary cinema, it examines the lives of those that struggle to survive in ecosystems that function according to their own decrepit principles.",1
68356," Cutes-E, but not enough gravit-E.",0
24086,This actually isn't as bad as it could have been. That's not high praise.,0
1929,"That it does not quite hit its target is unfortunate, but it does at least leave a watchable movie behind.",1
51531," Frears squeezes tension out of these interstitial moments, letting personalities rather than facts collide.",1
30657,"As fantasies go, you could do a lot worse.",1
238696, Gillespie is having so much fun...that you get the feeling he could make a movie about the contents of a phone book and it'd be deliciously entertaining.,1
52576,"You'd expect Gondry's version of a superhero movie to be either brilliantly creative or spectacularly misguided, and it's neither; just sporadically funny but more often plodding.",0
3262,[T]he film never really finds its footing.,0
292565," Fans of RED will enjoy seeing their favorite characters back on the big screen, but for less-devoted viewers RED 2 is only an average action-comedy experience.",1
23902,"Rich in quirky performances, amusing in its restless energy, it nevertheless frustrates with self-import and fishy enlightenment.",0
1682,A true strength of this film is its willingness to honestly portray the shortcomings of military procedure and how war crimes this brazen can happen under this country's nose.,1
45451,There is nothing unique about the film itself - except for the mesmerizing performance by Benedict Cumberbatch in the lead role.,1
19589,"Considering the iconic status of all involved, the result is disappointing.",0
399650," Genre fans may enjoy this as a weekend time-filler, or in the future on an airplane. I regret that I devoted nearly two hours to a promising picture that wound up being so mediocre.",0
3326,I'll say this: the animation is fantastic. The show has clearly received an upgrade in the quality department in the 13 years since it has been off the air.,1
168947," A calculated, well-told gimmick, and not much more.",1
190484," Does what most bad remakes seem to do, dropping what's essential about the original, keeping what isn't, and wrapping it all up in a glossy, generic, heavily-promoted package. ",0
283330," There is some harmless pleasure to be found when feathers aren't ruffled, when the fowl is not foul.",1
21457,"This is an uncharacteristically unsubtle work from Lee-yet in the end, it's not ineffective.",1
48528,"I am overwhelmed by the intensity of theme, and underwhelmed by the sophomoric content thereof, and so I end up in the middle, sort of whelm-neutral.",0
2161,Seeds masterfully explores what happens when one cannot stop the dam from opening.,1
314176," Donald Cried is free of ""nice guy"" characters and never relies on raunchy humor, the exclusions of which give the movie a greater sense of verisimilitude. ",1
27918,American Graffiti still bears the mark of a superb filmmaking talent.,1
12069, Nothing but leftovers.,0
33824,"While The Predator tries to lean on nostalgic reverence for that first movie, it also can't find a tonal mix that works.",0
4077,"Historically, The Awful Truth is probably most significant as the film that secured Grant's star, forcing him to adopt his famously relaxed persona through McCarey's improvisational approach to filming.",1
1414,"Unlike the titular meal, there's not much substance to the nostalgic screenplay, even if the ensemble cast brings a heartfelt charm to the predictable material.",0
4696,... more than as a period film set in the Civil War... [Full review in Spanish],1
12428,"So, okay, men are completely irresponsible slobs, which is why women need to be unceasing nags. Check. Great message for the kids.",0
32202,"The movie is drenched in atmosphere and dread, as we'd expect from Schrader, but it also has spiritual weight and texture, boldly confronting the possibility that Satan may be active in the world.",1
47737,One of those films where great acting and occasionally brilliant dialogue attempt to overcome an unbelievable plot and a cowardly Hollywood ending.,1
1704,"Eddie Murphy is perfect in the role of Rudy Ray Moore, and he's backed by fine supporting performances by Wesley Snipes and Da'Vine Joy Randolph, who plays Lady Reed/Queen Bee.",1
39762,"As we get to know the characters, it becomes clear that something deeper is going on.",1
281906," El vidente es una de esas películas que se pueden ver sin problemas, pues es bastante entretenida, pero que al final deja el sentimiento de que al espectador se le quiso tomar el pelo.",0
59855, The price of good intentions is that it looks and feels like an extended public-service announcement for goodness.,0
1825,"While The Awakening of Motti Wolkenbruch is fairly well-plotted and visually competent, it fails to transcend its familiar structure.",0
30691,"This one's a dog, all right.",0
5228,The biggest problem with The Professor is one of casting.,0
3692,"Though it lacks a certain edge, Long Shot is a tight, funny, and warm comedy with a ton of heart and two fantastic performances at its center.",1
428672," Subtle, quiet, delicate and unpretentious, Gloria is among the most satisfying films I have seen in years.",1
193869, A jarring thriller packed to the gills with cheap shocks.,0
5549,"A lovely character piece drenched in melancholy, I'll Take Your Dead is haunting and heartbreaking in equal measure.",0
331293," Absolutely, beautifully, tear duct openingly right.",1
3049,"Gibson has a solid presence with a nice hint of lively wit, while the notably astonishing Penn channels Minor's madness and genius in intriguing parallel.",1
358711, It's as much a triumph of boyish wish fulfillment as Peter Parker swinging on skyscrapers. ,0
409973," If you are going to go back to the 90s for source material, it had better come juiced with some modern day action.",0
931,"Freaks keeps you interested, but it never is completely coherent. Plot points are haphazardly strewn about to keep the narrative moving. The film doesn't earn many points for originality, but its low budget veneer is a draw.",1
30385,"Not boring, not captivating.",0
20611,This tale of a marriage of convenience charms and amuses with strong comedic performances with a great script and some beautifully shot sequences.,1
3931,"This low-key, unhurried baseball drama isn't entirely free of cliches, but thanks to a handful of quietly likable characters and a genuine appreciation for baseball, it has a modest, winning charm.",1
344033," ... the film, for all of its wondrous visuals and good intentions, never takes off and soars the way we keep hoping it will.",0
654,"An engaging personal essay documentary about not having children, complete with interviews, arguments, hard data and sound reasoning coming from both sides of the debate",1
251409, I could see lots of people enjoying the goofy sincerity and bonkers plotting. It was simply a struggle for me to get through and did not live up to the expectations I had for it.,0
3017,Writer/director Ben Younger blows a chance to make a powerful real-life Rocky movie. This one is an epic fail at almost every level. The worst boxing sequences of all time. ,0
54176,"A movie about snakes on a plane does not need to be straightforward; it only has a shot if it is either genuinely scary or so incredibly over the top it's funny. Snakes on a Plane is neither, but maybe Snakes on a Boat will be better.",0
1588,An incredible true story that should have never happened.,1
14905,...an erratic yet consistently entertaining summer blockbuster...,1
391095," When all else fails, and the last faint possibility of comedy has vanished, the director turns on the sentiment.",0
135431," Like all great holiday movies, Elf is a blend of humor and sweetness.",1
339148," The best that can be said of Knightley is that she's puppy-eyed eye candy, in vibrant reds and blacks with fur trims to die for.",0
1705,"Perhaps a lesser known cast, or a more focussed, personalised story might resonate, but in this glamourous, knotty form the players involved feel more distant than ever.",0
4220,"But there's room for a bigger discussion there, between two powerful women engaged in what is largely seen as a man's field, while Curtis and Sumpter are both extremely passionate in their few exchanges.",0
53063,"To see ""Selma"" is to feel and appreciate anew the burden of greatness.",1
157822, 8 Mile stands as a deeply flawed excursion harbouring a couple of deep satisfactions.,1
53899,"Kaurismaki's movies can tickle you with the briefest of statements, the smallest of gestures.",1
378722, Steven Spielberg's Jurassic Park first introduced me to what movie magic can be.,1
42405,"Your quintessential guy film. If you have any significant level of testosterone in your blood stream, you'll find something to enjoy about it.",1
51464," A smutty, bargain-basement version of In the Bedroom.",0
46472,"Fincher directs this chaotic fable with grace, urgency, and knockout stylistics.",1
48745,"If Spielberg had found a way to inject even a bit of the warmth, wonder, and intelligence we associate with some of his best-loved films, this might have been something special.",0
395269, The sight gags and one-liners are much too tepid for all but the smallest and least discriminating children.,0
13217," Extremely callous treatment of source material, hopelessly confused between presenting Bundy's or another's perspective, wasting incredible performances by Zac Efron and Lily Collins",0
151680," Solid performances, but the screenplay is a clunky, contrived and stilted mess.",0
189,"Don't think too hard about the plot twists or the rules of Frank's universe, because it will all fall apart. Just buy the ticket, sit back, and enjoy the ride.",1
10205,"Sweet, funny and touching.",1
420921," this bold feature debut yields disorienting (mind and) body horror, negotiating our fragile relationship with each other in a life increasingly lived online & electronically enhanced, where identity - even humanity - are open to radical redefinition.",1
3412,Anne Hathaway and Rebel Wilson are clearly trying but completely flounder with a terrible screenplay that meanders from set piece to set piece...,1
2043,Lives up to its title: it's no treat.,0
424814," Nine is all songs and no story, a vulgar artistic endeavor that adds nothing whatsoever to the classic film on which it is based.",0
214183," Although never challenging the original's high standing within the Pixar pantheon, this sequel showcases everything the venerated animation company does so well, providing plentiful laughs, ace action sequences and a deep emotional wellspring.",1
106602, Hugely engaging and quietly potent ...,1
50691,There are enough good moments in Ralph Breaks the Internet that you should not delete any ideas of seeing it. Just be ready to hit escape when things turn to the dark web.,1
18491,"The movie begins extremely well before escalating into the inevitable Straw Dogs confrontation, when the sensitive-intellectual man discovers, just like Dustin Hoffman, that when push comes to shove, we're all brutes and animals.",1
1823,"Concluding on an unexpectedly ambiguous note, the clichés of the film are thus salvaged by a thoughtfully unorthodox outlook on Orthodox Judaism.",1
3530,Monica Bellucci turns the internet a portal for demons. Goofy and inventive. Unfortunately gets lost in the minutia.,0
5292,"A largely thrilling endeavor that'll play well in television reruns, but may never find a stronger audience than that.",1
48253,"... a placid, almost pleasant film, so reluctant to offend that it fails to engage.",0
122655, This crass comedy smells like kitty litter.,0
46449,This movie is dangerous.,1
41814,This excellent sophomore film by a Chinese writer-director is a rare look at the life of a young Native American man.,1
32034,"Like a too-precisely choreographed dance, it feels lifeless.",0
13883,"Messing-Mulroney romantic comedy has ""something borrowed"" in its plot -- and a sense of missed opportunity that'll leave you blue.",0
53123,One of the most important films of the year. ,1
3746,"An intimate story of romance, betrayal and loss gets framed against the sweeping, epic backdrop of radical, socio-economic changes in China.",1
285284," Takes the whole chick lit package, the candy colored dresses and the personal chauffeurs, to a ridiculous, intolerable new level.",0
3008,"I couldn't help but appreciate the fact that, well, this guy will do it; he'll go there.",1
45417,"Despite the instances when it strays from, or grossly simplifies, the record...succeeds in presenting an affecting portrait of Alan Turing.",1
69945, Cue tonal misfires and a wealth of bumptious music. ,0
4061,"To die or not to die that is the question, And though it is well acted the whole thing is pretty depressing",0
233,"The ambition of Horse Girl ultimately gets the better of it, turning what could be a dark but insightful depiction on signs missed in a mental health crisis into an agreement on one's madness",0
2112,A cobbled-together mess of conflicting tones.,0
3678,"Thankfully, the voice cast is packed with popstars who are great at pouring sparky attitude into their performances.",0
411761," Unfortunately, consistent laughs weren't discovered until year two.",0
36699, So this is what deadpan slapstick surrealist Belgian stop-motion animation looks like. I like it!,1
3176, We buy the premise because of the film's dreamy quality: Phoenix's Berlin is a rubble-strewn labyrinth and its inhabitants walking ghosts haunted by the recent past.,1
34112,"When it comes to keeping the colored folk peripheral, this picture makes To Kill a Mockingbird look like Get on the Bus.",0
5115,"As a director, Neil Jordan fails to structure the film's gradual suspense. [Full review in Spanish]",1
436657," She is a brilliant documentary subject - plain-speaking, authentic, feisty and seemingly without ego.",1
631,"Even for someone like me who admires Dolan, the finished film is a bit of a mess. But it's kind of a beautiful mess, one that still has the power to be affecting.",1
287,"What we're left with is a sort of action-lark with Smith in good form, and a general thematic warmth and hopefulness that seems a bit naïve but is charming despite itself.",1
30345, Works on nearly every level and qualifies as one of the classics of modern horror.,1
181632," It's telling that the movie, after reaching a tidy payoff, takes one last spin into an epilogue that questions the actuality of almost everything that's come before.",1
19984,Bill Murray heads to Afghanistan in director Barry Levinson's dreadfully misguided farce.,0
2077,"The Pretenders is clever and cleverly performed, often visually alluring, observant, stylish and shallow.",1
21615,"A nice, heavy movie, if a bit depressing.",1
4229,Director Gilles de Maistre has produced an unmistakable labour of love.,0
24924,"Generally technically slick, briskly paced and painless to watch, assuming you're not the sort to squirm miserably at the sight of anatomical mayhem.",1
4582,"Warm, wise and wonderful.",1
5510,"Confined to a creepy house, the movie has a superb claustrophobic tone, both visually and psychologically. But the pace is slow as it churns along in between some atmospherically freaky moments.",1
5122,Aniara mostly feels like a dramatization of facts rather than telling a story.,1
3242,"Inventive, seductive camera shots are not enough to save this character study of two unlikeable characters.",0
2404,The heartwrenching tearjerker love story surfaces at the end as a winner by a narrow decision.,1
714,"It's one of those movies where if you think back on it, it might not completely make sense. But man was it a fun watch. Highly recommended for fans of twisty thrillers.",1
240344, Steve Carell soars with the best comics in funny business. ,1
134945," You'd be forgiven for thinking it was one of those awful ""Wild Things"" or ""Poison Ivy"" sequels.",0
179725," With Salaam, Nair proves an early ability with a camera and at getting performances out of obviously inexperienced actors, but her writing talents are much sketchier.",0
20811,"Reconfirms Spielberg as a master of action, here seamlessly integrating spectacular visual magic into the most mundane and familiar settings.",1
45486,"Thoroughly entertaining, utterly conventional. ",1
207183," Not everyone will want to go back for more, but those who do will find rich rewards.",1
4790, The evils of the internet are unnervingly unearthed in this teen-oriented thriller.,1
37217," Our Little Sister does best in small, quiet moments.",1
285493," From here on out, Elf is going to be a Christmas movie-watching tradition for me.",1
4011,"Ah, the London Blitz. Bombs falling, buildings on fire, people dying all around. Good times, good times.",0
410650," Though billed as a ""political thriller,"" The Report eschews explosive drama or white-knuckle tension.",1
5735,The Ring doesn't have the wiliness or conviction to exploit either a single mother's guilt over child neglect or our collective queasiness over potential bad seeds. It merely alternates these themes and toys with them.,0
1685,[Even] at only a scant 87-minutes I had trouble maintaining interest in all that was happening all the way through to the end.,0
4920,"The kids who first discovered How to Train Your Dragon are teenagers now, contemplating their place in the world, and their animated friends have grown up with them.",1
39774,"Only Craig's turn really leaves an impression, and you're left with the feeling that, for all its brio, Logan Lucky doesn't amount to a hill of beans, as they say in those parts.",0
455387," After a certain amount of inaction and anticlimax, a slow burn is just a fizzle. At 100 minutes, it uses up its suspense tricks early.",0
25579,Someone sent me this on tape. I may speak to them again one day.,0
21278,"If this picture were a little more ludicrous, just a shade more inane, it might be fun to watch. Unhappily, that is not the case.",0
1307,"My problem with this movie... is that it wants us to empathize with Thomas Jane's character. But the thing is, his character's just a crooked cop.",0
33768,"Before and after everything else, ""Get On Up"" is about the transformative power of performance.",1
2432,Justifiably one of the most indelible adventure films in cinematic history...,1
4542,Giant Little Ones is like a wake-up call and booster shot of empathetic engagement wrapped into one engaging film.,1
3243,"A fairly straightforward late-in-life romance between two lonely, misunderstood people.",0
212012," Jean is such a monster, and John such a put-upon sweetheart, that Glassland offers little more than undiluted bathos for over an hour.",0
346284," A bizarre celebration of dumbing down that fails to work as satire, comedy or romance. The characters are one-note and a good cast is wasted.",0
38394, One of the best movies ever made about high school life in America.,1
113593, Mordant young adults might enjoy its maudlin wallow.,0
26151,Makes us laugh and frustrates us at the same time.,1
82960," Why resurrect an American literary giant onscreen so he can help a police investigation? Sure, Poe essentially invented the detective genre, but come on. ",0
11972,...strikes a nice balance between starry-eyed romanticism and cynical detachment.,1
348296, ...offers a raw view of the gay experience that has nothing to do with sex.,1
318552, A worthy - if chilly and difficult - addition to the sadly extensive filmography of American mass murder. The soundtrack from Canadian singer-songwriter Maica Armata adds some much-needed heart.,1
251820," A more accurate and representative title might have been ""Remaking Woodstock"" because that's clearly what Lee set out to do.",1
776,"A suitable entry into the science-fiction/horror genre that occasionally promises something more. And while the film's science-fiction/horror elements don't disappoint, the promise of something more doesn't quite pull through.",1
37184,Overbearingly cruel and only modestly funny.,0
3833,"Comic book purists will have nitpicks to gripe about, but the film brings a solid amount of Loeb's iconic Hush to life on the screen which should satisfy casual fans.",1
186530," A staggering, symphonic watermark in cinema.",1
40414,"Nothing works: not the haphazard stabs at conjuring a sweet-and-sour comic tone, not the reliance on people saying horribly inappropriate things in lieu of actual jokes, and not the one-note characters ...",0
238,"An incongruous, engaging ride, Horse Girl doesn't hit all the marks, and some audiences will become deterred, but Brie's tour de force performance is truly the base and it's one worth jumping off from.",1
1453,Gets a pass for being entertaining and wholesome while embracing the rich modern diversity of this generation.,1
4987,"Stephen Merchant, The Rock, and the WWE kinda knocked it out of the park with this one. Fighting With My Family is a dope, heartfelt movie with all the bumps and excitement that's in pro wrestling.",0
3478,"It's a film that falls far short of its potential and, during its dull moments, you can't help contemplating its assorted missed opportunities.",0
5400,"Everything goes on way, way too long and so many of the characters are horrible.",1
42044,"Nolan's most perfect commentary on his favourite auteur theme of mise en abyme, as both magicians in their own ways make near Faustian pacts for their climactic 'prestige'.",1
12685,Seinfeld's quick wit and glib personality are strong enough to give the scattershot story an illusion of coherence.,1
47,"This is an unfussy genre entry that seasoned fans will eat up, thanks to the no-nonsense attention to world and character building.",1
330,"Cleverly written by a gaggle of writers, including director Bernheim, the film is an amazingly precedent look at the state of ""fame"" today.",1
406835, There are moments when a lot is left unsaid. There's a remarkable stillness and delicacy as the music and images interplay and do all the talking. ,1
10825,"One of those flicks that relies purely on momentum to keep your disbelief suspended, and director Pete Travis rarely allows the pace to slow enough for the plot holes to shine through.",1
317,"One of those properties that works no matter the format whether a series movie or its latest iteration, a stop-motion animated movie, that's worthy of two snaps up.",1
386752, A relentlessly immersive tour de force.,1
41585,"Many of The To Do List's jokes have this first-draft, is-that-all-there-is? quality.",0
25207,"The key to the film's success is its lack of strain. As written by Jose Rivera and Tim Sullivan, this isn't one of those pushy slapstick affairs; it's more romantic than comic, and despite the corn there are no villains.",1
3531,...a deftly directed B-grade midnight movie with lashings of laconic Aussie humour and splattery set pieces.,0
344609," Gibney offers no conclusion but the familiar paradox: great products, unpleasant person.",0
3109,"Franklin's voice fills the room. Nearly a half-century later, many audience members will feel just as carried away.",1
2370,"Comedic elements [are] key to the film, which soon delivers a twis that casts its entire portrait in a different light, causing viewers to reassess not only what they've just seen, but also their assumptions about cinematic and internet truth circa 2019.",1
4137,Here is another illustration of how the faith-based drama has pushed into cinemas material indistinguishable from vast swathes of the afternoon TV schedule.,1
670,"The musical, cinematic, and human reverberations of the film connect us to the art of one of the greatest icons that emerged from the legendary Hollywood. [Full Review in Spanish]",1
