,Freshness,Review
1,1, Director Wayne Wang proves with Maid in Manhattan that even predictable movies can leave you feeling warm and fuzzy.
3,1, A riveting documentary that explains education and the violent changes that are rocking Pakistan.
9,1," With its emphasis on nature and its mudbound farmers, this beautifully crafted film recalls other earthly European historical dramas set in an isolated countryside."
10,1," It's not like having a real film of Nijinsky, but at least it's better than that eponymous 1980 biopic that used soap in the places where the mysteries lingered."
11,1,"The intelligently observed and staggeringly beautiful Italian foreign-language Oscar nominee is about life, death and the search for the things that give meaning to both."
15,1, The Cell's striking visuals along with its fantastical costumes absolutely mesmerize the viewers.
17,1, [House of Wax] gleefully trots out all the clichés of the genre before going out in a blaze of glory with a truly spectacular final act.
18,1, treats the audience with respect without being overly pretentious
19,1,"This movie's calm, steady control keeps a wide variety of good actors in the same universe."
20,1," As usual with Pixar, the film looks like a moving work of digital art, though its inordinate length might test the patience of six year olds who will love the brilliantly staged action but not all the exposition-heavy dialogue."
22,1, The story is incredible.
24,1," It's virtually all Hemsworth's show and he's entirely up to the task of carrying the film on his broad shoulders: He's charismatic, fearless, confident, jokey and a good old Kentucky boy who just wants to get the job done ..."
25,1," An exhaustive, ruminative, angry and even occasionally gallows-humorous account of the strange domino effect of tragedy compounding incompetence compounding tragedy that dealt a critical blow to one of America's great cities."
30,1," An intense mix of horror, thriller and domestic drama, this is exquisite filmmaking."
32,1," It takes all of 10 minutes for Doremus' film to reveal itself to us: this is a movie about a conflicted father who has arrived at a crossroads, both morally and artistically."
38,1, An utterly amazing and riveting start to a brand new beginning...
46,1," Though ""Thor: Ragnarok"" may feel like a lightweight entertainment, it comes packed with the same ingredients that made Whedon's ""The Avengers"" so good."
48,1," A superb, impassioned concert film."
49,1," Though Nixey carries it across with some style, some intensity, and some graphic imagination, the whole isn't quite the sum of its somes."
56,1, A narrative shapeshifter that gleefully toys with its audience's perception of love and themselves.
58,1," A quick, efficient thriller that gets right to the point."
60,1," Greene has made a hard movie to argue with, even as he invites you to do exactly that."
61,1," Star Chris Pratt says it best, 'It's adventure, it's romance, it's a thriller, it's scary, but it's emotionally resonant.' Amen. Once you accept the premise, with good acting and special effects, this is a terrific way to spend two hours."
63,1," I like the idea of this, I like the look of this...It's kind of superficial, and I don't know [if] there's a whole lot of depth to whatever allegory this is intended to be. It's just an exercise in style, and that's cool. "
65,1," Imagination is the real star of Sendak's classic and Jonze and his co-writer, Dave Eggers, have expanded on its brief text to spin a story in which the tough and the tender smoothly coalesce."
67,1,Gallo's combination of crudeness and sophistication has a preternatural power.
68,1, This chick-lit flick is an 'English Patient' style epic.
70,1," [MacGruber is] a film that's easy to watch and consistently funny, even if it is as substantial as a merengue."
75,1," Romantic comedies are a staple of popular cinema and I Love You, Man follows a familiar trajectory, but in a refreshingly different way."
78,1, Co-writer and director Billy O'Brien does a masterful job of building up the creep factor but gets too ambitious in the second half of the story.
79,1," A fascinating and intoxicating tale of cannibalism that examines the savage sexual awakening of a shy adolescent, whose complex psychology and inner struggle are described with great delicacy. [Full Review in Spanish]"
82,1, Subjects that would seem like rom-com contrivance in lesser movies are sturdy and thoughtful here. It's a well-filled romance.
84,1," The story's time-travel elements never quite make sense, but subtle performances and directing give this film an unexpected edge."
87,1," Consistently warm, and in moments savvy and irreverent, this feminist day trip of Asian immigrants to a British searesort contains some lurid and funny fantasies staged in the colorful Bollywood style."
88,1, The Gospel According to André is the most essential fashion documentary since Bill Cunningham New York in 2010.
89,1," B.B. King. Bill Withers. Miriam Makeba. Celia Cruz. And James Brown, earning every inch of the title, ""Godfather of Soul,"" who all by himself probably deforested a few acres around Kinshasa with the volcanic blast of his set."
90,1," It illogically breezes by, even if much of the story shows our heroes doing little but hiding, fighting, and strategizing. "
91,1," Sure, we can nitpick things like Joe Colton not having a beard, or Roadblock not talking in rhyme, but the spirit of the property many of us loved in one form or another is there."
92,1," There are some great, brilliant action scenes, but this is more thoughtful and darker and more in the vein of Batman Begins. And that's a very good thing."
94,1," A solid-enough L.A. noir whose hook, and albatross, is the transformation of a beautiful Oscar-winning actress into a desiccated crone."
95,1,"Neither revolutionary in its approach or subject matter nor seamless in its storytelling, Billy Elliot nevertheless manages to sketch the lives of characters we come to care about."
99,1," God Help the Girl is a smart, powerful little flick. Sometimes I hated it. But I won't forget it."
101,1," Blue Jasmine captures a manic and delusional woman attempting to rebuild herself after a prodigal life she received, but never deserved."
102,1," It's clear that this portrait of a sick society is meant to explain, at least partially, the horrendous war that breaks out at the very end of the film, and the fascism that quickly followed in its wake."
104,1,"Confident, uncompromising and blisteringly realistic, Sweet Sixteen is a gritty and immediate film yet it goes right to the emotions."
105,1," Torres's...writing is blunt and evocative, like poetry turned prose. The new film adaptation of the book by director Jeremiah Zagar turns the story back into poetry again."
106,1," Storytelling in its purest form: it works as a no-fat thriller, yet it achieves nuanced character dimension and thematic complexity"
108,1," People cynically walk into so much expecting disappointment - auditoriums showing Woody Allen's annual crapshoot, for example. Sometimes, they get expected middling results. Sometimes, as with Allen's 30-year-old script, they get unanticipated surprises."
109,1, A meticulously researched and ably handled chronicle of one of the largest corporate scandals in American history.
110,1, Michael Douglas with his giant crazy man stare and beard to match is quite funny.
111,1," Despite a nagging sensation about its shortcomings, the acting and the atmospherics continue to haunt me."
114,1, It's clear that Mbatha-Raw is a precocious talent.
116,1, The two leads manage to carry the day through sheer gumption.
118,1," Its initial enigma seems to need no explanation; yet, once deciphered, the film does not falter but moves only deeper into the emotional territory it charts."
121,1, The rampaging reptile is back to remind us that monsters have meaning.
122,1," Marjorie Prime is ultimately more about its ideas than its characters, but that's OK, because they're fascinating ideas. "
124,1, It's so much fun that it's easy to overlook the film's rather conventional plot arc.
126,1," It's nice to see the always compelling Hawke - here, tenser and more laconic than ever - in a role where his face's deep stress lines come into their own."
128,1," This is a delightful movie, funny, absurd, anarchic and profound. "
129,1," One would have to invoke supernatural influences to make it believable, and that is pretty much what is being invoked."
133,1, A work of battered brilliance.
136,1," Mockingjay Part 2 is a fittingly dark end to the Hunger Games franchise, not as exciting perhaps as Catching Fire, but more politically charged."
137,1," As with fights, we understand at all times what we're seeing; Surprises aren't the result of whim or betrayal to the logic of the story. [Full review in Spanish]"
138,1,"Not only does the film effortlessly mock the sense of wonder and the emotional roller-coasters we've all felt watching Pixar's big-eyed sentient objects, but, in its own messed-up way, it provokes some new feelings, too: shock and awe ..."
140,1," No, it's no Fargo. It's the most flamboyant, erratic, spontaneous movie the Coens have ever made."
142,1," The movie is quite derivative, transplanting the familiar tropes of the fantasy genre onto owls. Still, I liked it well enough to endorse it for smaller children."
143,1,"... pay your money and take the ride,... laugh and ... be strangely moved by the odd-looking creatures Russell has assembled for his latest ensemble play."
149,1," Another exceptional piece of propaganda, designed to get you riled up, but also to get you to laugh."
152,1," ...while it doesn't achieve the brilliance of the modern Batman franchise, and while it certainly has a few flaws... the action is undeniably well-done and there are still good character bits throughout."
153,1," I was afraid this was going to be another case where a greedy studio doing a book adaptation managed to screw things up by splitting a book in half, ending up with a movie with half a story, but this one works out O.K."
156,1," The film gets long in the tooth and it's ambition to be both dirty and touching spreads a solid story a little thin...but ""Trainwreck"" has so much in it to like, not the least of which is the future potential of more Amy Schumer/Judd Apatow collaborations."
158,1," It's rare for a film about a Mexican drug cartel and the impossibility of the American Dream to be either disarming or funny, but Clint Eastwood has blessedly delivered one that is consistently both."
159,1, It's an example of a clever actress taking control of her career.
160,1, The film delivers laughs and heart and some strong ideas and energy...
161,1," An attractive and robust screen adaptation of the classic 1861 Dickens parable of false hopes, thwarted vanities and the mysterious workings of sowing and reaping."
166,1," ...a perfectly tuned sense of character nuance [that] holds you more spellbound than 90 percent of Hollywood's ""crowd-pleasers."""
167,1," Rugrats again blends poignancy with fun in a way that touches parents, even as it goes for kids with a run of bodily function and booger jokes."
169,1," The Adventures of Tintin can be a delight to look at, even if motion capture isn't your particular cup of animation tea."
170,1," Fusing the personal and the political, Bouchareb's stirring war drama comes with a modern-day resonance and plenty of punch. Recommended."
171,1," Vicky Cristina Barcelona, which Allen wrote and directed but did not act in, is Woody at the top of his game."
172,1," Combining, as Meyers films do, pleasant fantasy with aspirational settings. I know I'll watch it again when it comes on cable, or if I have the flu or need to fold laundry."
173,1," An epic, evocative of another epoch and of landscapes beyond time."
175,1," A bombastic three-hour saga that moves like a 1,000-page book left idle in front of a window fan."
176,1," The film never stops moving, and it's always a pleasure to watch."
177,1,"The ultimate destination creates the opportunity for Penn to draw up a summation for his protagonist's journey, and it's a moral that should satisfy those viewers looking for meaning and order."
178,1," Before taking a dark swerve into chilling verité at the close, BlacKkKlansman ... kicks up suggestions of the pilot for a great 1970s mismatched cop show. It's that funky."
181,1," The film teases us with a paradox: arguably Nim's keepers were wrong to try to endow their protege with human attributes, but can we empathise with his suffering without making the same mistake?"
183,1," If you watched all of the ""Mission: Impossible"" films in a row, starting with 1996's original, would they feel like a James Bond version of ""Boyhood""? Maybe."
184,1," Jordan Peele has made something scathing, hilarious, and -- as unlikely as this may sound -- totally fresh. I am pleased -- who am I kidding? I'm f----g thrilled -- to announce that Get Out is a legitimately great movie."
185,1, A warm and moving sleeper hit.
186,1, It's a powerful drama that works on a couple of levels.
187,1," It's a great subject, with great objects of fascination, study, interpretation."
191,1," An action thriller that, while flawed, still reminds us that, if he really wanted to, The Rock could still become the next Schwarzenegger."
192,1," The specter of [John] Hughes is all over this entertaining, clever, and finally heartwarming comedy."
193,1," In these linked vignettes, Another Year paints an empathetic portrait of working-class contentment and anxiety."
194,1," First and foremost...the reason to go see ""Blue Crush"" is the phenomenal, water-born cinematography by David Hennings."
197,1," At its best, Tropic Thunder skewers impotent directors, fascist producers, prima donna stars and classic scenes from the camo-fatigues genre."
198,1," A meticulously shot and sharply written character study, it plays like a blend of the Coen brothers and Quentin Tarantino."
199,1," The acting is very convincing by Hoss and Zehrfeld. Writer-Director Christian Petzold (""Barbara"") has crafted a compelling ghost story about a woman, thought to be dead, who gets a chance to see what people really thought about her."
203,1," Exciting, provocative genre cinema."
204,1," The humor is spot on, and the film drew some genuine laughs from me, especially the scene with Richie and the cricket bat."
205,1," The sins of fathers, sons and lovers come pouring onto the audience in a torrent of stifling intensity."
208,1," Endhiran -- The Robot provides maximum bang for its reported $34 million budget with a sensationally overstated and overwhelming mash-up of American-style, f/x-driven sci-fi spectacle and exuberant Bollywood-style songs, dance and romance."
209,1," A perfectly enjoyable exercise in superheroics, and much more fun to watch than 'Man of Steel'."
211,1,Delivers the goods as a zippy piece of sci-fi pulp.
212,1," A sometimes scathing, sometimes goodnatured satire of the French film industry."
213,1," ""The Exception"" is a diverting and occasionally exciting film, though it is rarely disturbing or thought-provoking in ways the material might require."
214,1," Elliot's record of an unconventional friendship revels in grotesque detail and scatological humour, but yields unexpected depth and poignancy."
217,1, A gift of a documentary.
220,1, [An] affecting study of independence and friendship.
221,1," As one might expect from a zombie romance, the film doesn't pack a lot of big ideas. Still, the concept is original, and watching it unfold is loads of fun."
225,1," Watching Carell and Fey in action, trading quips and dodging gunfire as they attempt to make their way home to white-picket-fence suburbia, makes you wonder why it's taken so long to bring these two gifted comics together."
228,1," Fincher's strange romantic epic has its greatest impact the first time around. Overall, the film seems more like a beautiful curio than anything else, a sort of artsy fartsy Forest Gump."
229,1," It's exciting, foreboding, grand and important, a part of our culture and identity no matter how loudly cineastes scream bloody murder."
231,1, City of Men has the electrically oversaturated style of reality that made City of God such a searing vision of teenage criminal life in the slums of Rio de Janeiro.
232,1, ... a unique and engaging reworking of an enduring genre.
233,1, Depicts a side of Abraham Lincoln and the American political system that is equally stimulating and intellectually inspiring.
234,1, Slick and playful entertainment that remains carefully inoffensive beneath its veneer of bad manners.
235,1, The changes suit the demands of mainstream cinema and the warm aesthetic Batra exhibited in his first film. This is a smart piece of translation.
236,1," It's an exciting experience, dazzling and entertaining and thought-provoking."
237,1," The actors make these characters vivid, within a structure that is recognisably Malick's."
238,1, It's impossible to tell the experienced from the inexperienced among Loach's casts.
239,1,"Absorbing, often electric with the energy of the playing field, Invictus is packed with feel-good ""teachable moments"" without the sugary aftertaste."
242,1," The film definitely has its moments, and at arm's length, The Promise will resonate. But overall, it feels like a missed opportunity, a good film that could have been much better."
243,1," The film builds steadily, but never tediously, to the long awaited mission to Abbottabad and the compound housing Osama bin Laden."
244,1,An entertaining comedy that far surpasses his previous American films.
245,1, There are definitely sentimental and predictable moments but it is enjoyable.
249,1," Hail, Caesar gives us a colourful feast full of excess and fun."
250,1, An inoffensive and relaxed offbeat comedy with just enough heart to carry it through.
251,1," Director Michael Polish and his co-scenarist and brother Mark don't fall into the trap of trying to redo Frank Capra. They have their own approach to the material, with an eye for the eccentric amid the commonplace adding just the right touch of humor."
252,1," The film's color photography is extraordinarily lovely for, like the conspirators within the film, Bertolucci has a weakness for the purely theatrical effect."
253,1," This is a modern day Capra movie, which means you might be embarrassed to tell your friends you went to see it, but you left the theater with a big smile on your face."
254,1," It's a story where, perhaps, there's enough guilt to go around. But the credit for telling it goes completely to a bright young talent."
257,1,Sam Peckinpah doesn't find anything to cheer about when his Man expresses his rage.
258,1, A true classic worthy of its highest praises.
259,1," ...we've seen all this before (""Bad Santa"" being but one example). Still, Murray is Murray and watching his sweetness peek through his outer curmudgeonly crust is worth the price of admission. More surprising is Naomi Watts..."
260,1," Even non-fans will get a thrill or two, followed by a quick laugh and a feeling like someone is trying to insult their intelligence."
261,1, A beautiful and shamelessly honest film about the fragility of life. [Full review in Spanish]
265,1," This 1930s-set drama chronicling events leading to the deportation of a little-known, real-life Irish political activist is a graceful digest of Loach's signature motifs."
270,1," An examination of whether vigilante justice - no matter how well-intentioned at the start - is doomed, ultimately, to become just another example of would-be good guys falling prey to the lure of egotism and/or big money."
271,1," An authentic depiction of depression, mental illness, and a poetic meditation on mankind's relationship with the universe."
273,1," The same effortless chemistry that made the comedians such ideal Golden Globes hosts is on full display in this broad comedy, given extra oomph by a wise and glorious R rating that opens the floodgates of creative vulgarity."
275,1," Lovelace finds a fresh take on familiar material, but the film is also distinguished by its focus and intensity."
276,1," Nothing in Uncovered: The War on Iraq will change your opinion, but it may give you bullet points to back up your cocktail-party arguments."
278,1, The show is fun and fact-filled. A smart peak into how the past informs the present that does right by taking the funny stuff seriously.
279,1," It's often at its best when it's off on a moody tangent. But it has something and is well worth seeing, especially if you're a horror fan or a fan of art cinema"
280,1," Sure, it's complicated, but isn't that always true of romance? And doesn't it blow the hinges off the universe -- every single time?"
281,1," This incarnation of Fanny may not have been what Austen had in mind, but she surely would have approved, for the injection of attitude and smarts makes Mansfield Park a much more wicked and irresistible social satire..."
283,1," [Director Dome] Karukoski guides us on a journey of reflection, where distance is not so much geographic, but emotional. [Full review in Spanish]"
285,1, [Oliver] Stone uses a lot of visual effects to give some energy to a very conventional story...
286,1," There's nothing like seeing Fela himself - blowing his sax, expressing his unbridled sexuality and living a life like no other."
290,1, A rather watchable film that is reminiscent of The Bodyguard (sans the stalker sub-plot) that also works well as warm-hearted romance with soap opera elements.
295,1,"What Black's movie really has going for it is pace. It starts with a crash, followed swiftly by a bang and vast swathes of wallop. The relentlessness doesn't allow you any time to catch a yawn, but it's also not too conducive to tension or suspense."
296,1," Real-life love stories rarely work out quite so faultlessly, but for two hours it's nice to believe that they could."
297,1," Another year, another mix of ""The Amityville Horror"" and ""The Exorcist."" Solid acting and an emotional back story set this one slightly apart."
298,1," While prone to arty lingering, thus wasting time that would have been more wisely spent plugging gaps in the narrative, Shortland slathers the story in enough mud and horror to make it a compellingly visceral experience."
299,1," Boasts the stock characters and situations, sentimentality, foreshadowing and melodrama of soap opera. Yet by cleverly blending these ingredients with those of an action caper, the pic presents a fresher appeal."
301,1," Well, it's a more fun trip to Rio than Rio. As the reckless flailing of a lot of meatheads, Fast Five is essentially a food fight with sloppy Joes."
302,1, The Secret World of Arrietty is a marvelously captivating animated feature about very tiny people and the full-scale world they inhabit.
303,1,"The Mambo Kings"" is so pumped up with life it threatens to burst. It's beautifully filmed and flashily edited. It pulsates with rhythmic ecstasy. It throbs, it sweats, it pounds, it undulates."
304,1, The film does not disappoint despite having moments where it could have more nuance. [Full Review in Spanish]
305,1," It's not the deepest movie of the season, but it has sprightly performances and cinematic style to spare."
310,1," It's almost as if the whole Peanuts universe has been encased in Carbonite, shipped to 2015, then unfrozen like Han Solo, ready for movie duty."
311,1, Manages to surprise and engage the viewer in a way you may not have expected.
312,1," As it stands, it's an efficient, diverting new entry in Neeson's ongoing action canon, albeit one which suggests his He-Man career route has finally reached the end of the line."
315,1, Tim Burton magic with just a touch of scariness.
316,1,"If the thought of another Australian film with a soundtrack full of ABBA songs scares you away from this film, buck up and see it anyway."
318,1, A horror-fantasy that all involved should be wholeheartedly proud to be a part of.
320,1," From a philosophical viewpoint it's fitting that the inaugural movie to unite martial arts legends Jackie Chan and Jet Li is a fantasy film for young teenagers. Forbidden Kingdom"" may not be ""Enter the Dragon,"" but it's not supposed to be."
321,1, Even basketball-phobes will enjoy it.
322,1, A superhero tale that feels fresh and new...
323,1, Star Andy Samberg & Co. are at their best when they're deadpanning as addlepated celebrity man-children whose vision of the good life involves the getting of ways and the indulging of whims.
324,1, Lelio's observational and unobtrusive direction trusts the lead to carry the weight of the film. Moore characteristically rises to the occasion.
325,1," There is a sense that the picture ends just as it gets going. But it's a movie that understands co-dependency from the inside, as well as the helplessness and hopelessness of trying to cure someone else's addiction."
328,1, Your response to all this depends extremely heavily on how much philosophizing and pretty pictures you're willing to accept in lieu of a story.
329,1, Stephen King's The Mist is a reminder of what a great horror movie is all about.
333,1," 3/4 is a small but ambitious drama with a perfectly symmetrical structure, using minimal means, nonprofessional actors, and everyday conversations to convey its characters' innermost feelings. "
335,1," Aaron Johnson may not be Lennon, but he?s entirely persuasive as someone who could have grown up to become him. It?s a striking pre-incarnation. "
336,1," Once you've been away from 'The Fall' for 24 hours or so, you reflect on its sheer beauty."
337,1, [F]eatures one of the most engaging ensemble casts I've seen in a goodly while... So hurrah for this band of gal pals at various romantic crossroads...
338,1, More of a dramatic freak-out than your standard teen slasher horror. Although the effect is exactly the same.
